Quando è concesso l'abbuono dell'accisa nel caso in cui ci siano delle perdite di prodotti in regime sospensivo che sono legate alla natura stessa dei prodotti e verificatesi durante i processi di lavorazione o di fabbricazione di quei prodotti, nei casi;a) Con apposita istanza all'Agenzia delle Entrate.;b) Solo entro i limiti dei cali tecnicamente ammissibili, determinati con decreto del Ministro dell'Economia e delle Finanze.;c) L'abbuono dell'accisa è sempre concesso.;d) Non è mai concesso l'abbuono dell'accisa.;2
A quale conseguenza va incontro chi effettua operazioni di miscelazione non autorizzate da cui si ottengono prodotti soggetti ad una accisa superiore a quella assolta sui singoli componenti?;a) Alle sanzioni previste espressamente dall'art. 40 del T.U.A.;b) Non va incontro ad alcun tipo di sanzione.;c) Sempre e solo a sanzioni amministrative.;d) Nessuna delle alternative proposte è giusta.;1
Quali operazioni svolte sui prodotti sottoposti ad accisa e in regime sospensivo d'imposta sono effettuate in regime di deposito fiscale?;a) La detenzione, la fabbricazione e la lavorazione.;b) La fabbricazione, la lavorazione, la trasformazione e la detenzione.;c) La fabbricazione, la lavorazione e la trasformazione.;d) La trasformazione e la lavorazione.;2
I depositi fiscali...;a) Sono assoggettati a vigilanza finanziaria e si intendono sempre compresi nel circuito doganale.;b) Sono assoggettati a vigilanza finanziaria e non si intendono mai compresi nel circuito doganale.;c) Sono assoggettati a vigilanza finanziaria e, salvo quelli che movimentano tabacchi lavorati, si intendono compresi nel circuito doganale.;d) Non sono assoggettati a vigilanza finanziaria e, in determinati casi, si intendono compresi nel circuito doganale.;3
Quali sono gli Organi che possono esercitare le potestà di controllo sulla circolazione dei prodotti di cui al Testo Unico sulle Accise, individuati dall'art. 18, comma 6?;a) nessuna alternativa è corretta.;b) La Guardia di Finanza e l'Agenzia delle Dogane.;c) La Polizia Stradale, la Guardia di Finanza e l'Agenzia delle Dogane, quest'ultima solo nei limiti delle facoltà concesse dall'art. 31 della Legge 7 gennaio 1929, n. 4;d) La Guardia di Finanza, l'Agenzia delle Entrate, solo nei limiti dello specifico servizio effettuato e delle attribuzioni conferite dalla norma, e l'Agenzia delle Dogane;2
La birra prodotta da un privato e consumata dallo stesso...;a) E' esente da accisa anche qualora formi oggetto di attività di vendita.;b) E' comunque sottoposta ad accisa.;c) E' esente da accisa purchè non formi oggetto di alcuna attività di vendita.;d) Nessuna risposta è corretta.;3
In ambito accise, cosa si intende per perdita?;a) Provvedimento con il quale si riconosce lo sgravio di un debito di imposta.;b) Mancato versamento dell'imposta dovuta.;c) Esenzione totale o riduzione dell'imposta prevista per gli usi normali.;d) Mancanza di prodotto per cause naturali /accidentali.;4
Nell'ambito dei controlli da parte della GdF sulla circolazione dei prodotti sottoposti ad accise, si può effettuare il riscontro della qualità del prodotto?;"a) Sì, è sempre
obbligatorio il prelievo di campioni.";"b) Sì, attraverso
l'adempimento eventuale del prelievo di campioni, qualora ve ne sia la necessità.";c) No, a meno che non sia il trasportatore a farne richiesta.;d) No, non è mai possibile.;2
Ai sensi dell'art. 41 del Testo Unico Accise, la fabbricazione clandestina di bevande alcoliche:;a) Nessuna delle alternative proposte è corretta.;b) Viene punita solo con sanzioni amministrative.;c) Non è sanzionata.;d) Viene punita con sanzioni penali.;4
In tema di alcole e bevande alcoliche, quali soggetti NON devono essere dotati dal codice accisa?;a) Produttori di alcol etilico.;b) I piccoli produttori di vino.;c) Produttori di alcolici intermedi.;d) Produttori di birra.;2
Il codice accisa...;a) Gli ultimi due caratteri identificano la provincia del deposito fiscale.;b) E' uguale per tutti i paesi dell'UE.;c) Il terzo carattere identifica il settore impositivo.;d) E' un codice alfanumerico di 13 caratteri.;4
La produzione di liquore da parte di un privato, per uso esclusivo del medesimo, con impiego di alcole ad imposta assolta, è soggetto ad autorizzazione?;a) Nessuna delle alternative proposte è corretta;b) In nessun caso.;c) Sempre.;d) No, a condizione che i prodotti ottenuti non siano merce in vendita, come descritto dall'art. 27 comma 2 T.U.A.;4
La verificazione periodica dei distributori di carburante ogni quanto deve avvenire?;a) Ai sensi dell'art. 2 D.M. n. 182/2000, la verificazione periodica dei complessi di misura dei ditributori di carburante deve avvenire entro 45 giorni dall'inizio della loro prima utilizzazione e poi ogni due anni.;b) Ai sensi dell'art. 2 D.M. n. 182/2000, la verificazione periodica dei complessi di misura dei ditributori di carburante deve avvenire entro 60 giorni dall'inizio della loro prima utilizzazione e poi ogni tre anni.;c) La verificazione periodica dei complessi di misura dei distributori di carburante deve avvenire entro 60 giorni dall'inizio della loro prima utilizzazione e poi ogni due anni, ai sensi dell'art. 2 D.M. n. 182/2000.;d) Ai sensi dell'art. 2 D.M. n. 182/2000, la verificazione periodica dei complessi di misura dei ditributori di carburante deve avvenire entro 30 giorni dall'inizio della loro prima utilizzazione e poi ogni tre anni.;3
Che caratteristiche deve avere un impianto di distribuzione commerciale di prodotto energetico per essere considerato tale?;a) Il serbatoio contenente il prodotto energetico deve essere collegato ad un manometro in grado di quantificare il prodotto in euro e dollari USD, in tempo reale, al momento dell'erogazione.;b) Il serbatoio contenente il prodotto energetico non deve essere collegato ad una colonnina con erogatore in grado di quantificare il prodotto in euro e dollari USD, in tempo reale, al momento dell'erogazione.;c) Il serbatoio contenente il prodotto energetico deve essere collegato ad una colonnina con erogatore in grado di quantificare il prodotto in euro e dollari USD, in tempo reale, al momento dell'erogazione.;d) Il serbatoio contenente il prodotto energetico deve essere collegato ad una colonnina con erogatore in grado di quantificare il prodotto in euro, in tempo reale, al momento dell'erogazione.;4
Esistono comuni italiani esenti da accise, I.V.A. ed imposte sui consumi per le forniture di prodotti petroliferi?;a) Si, ma solo i comuni aventi oltre 15.000 abitanti.;b) Si, ma solo i comuni aventi oltre 100.000 abitanti.;c) Si, ma solo i comuni aventi oltre 25.000 abitanti.;d) No.;4
Il coke di carbon fossile rientra nel catalogo dei prodotti sottoposti ad accisa?;a) No;b) Dipende dalla qualità;c) Sì;d) Dipende dal peso;3
Il biodiesel e il bioetanolo rientrano del catalogo dei prodotti sottoposti a tassazione?;a) Sì, sono sottoposti a tassazione per equivalenza;b) Dipende dall'uso di destinazione;c) No, non sono sottoposti ad alcuna tassazione;d) Sì, solo se trattati;1
Il codice accisa è composto da vari caratteri. Cosa rappresentano quelli numerici?;a) La sigla dello Stato membro dell'U.E;b) La sigla del capoluogo di regione di provenienza;c) Il numero d'ordine di attivazione dell'opificio;d) La sigla della provincia italiana di provenienza;3
"Nel riscontro della qualità del prodotto trasportato, il ""prelievo di campioni"" risulta essere un adempimento indotto da quale necessità?";a) Verifica di eventuali variazioni del destinatario o del luogo di consegna.;b) Verificare gli aspetti qualitativi e quantitativi del prodotto trasferito.;"c) Verifica dell'indicazione
del tempo occorrente per il
trasferimento delle merci.";"d) Verificare la posizione fiscale del prodotto trasferito rispetto a quella dichiarata nella documentazione accompagnatoria; accertare inoltre l'effettiva presenza delle sostanze denaturanti e/o coloranti che individuano prodotti esenti o agevolati.";4
Da chi viene effettuata l'analisi qualitativa dei prodotti sottoposti ad accisa?;a) Polizia scientifica.;b) Camera di Commercio.;c) Laboratorio chimico dell'Agenzia delle dogane.;d) Dal Ministero Industria Commercio ed Artigianato.;3
Gasolio e benzina destinati alla navigazione o all'impiego in agricoltura vengono assoggettati ad accisa?;a) Sì, sono sottoposti ad accisa con aliquota agevolata.;b) No, sono prodotti esenti da accisa.;c) Sì, sono prodotti sottoposti ad accisa.;d) Nessuna delle risposte è corretta.;1
Per i depositi fiscali abilitati alla fabbricazione dei tabacchi lavorati da chi deve essere effettuata la vigilanza fiscale?;a) Dal personale dell'Amministrazione Pubblica del Comune interessato.;"b) Dal personale
dell'Agenzia delle Entrate.";c) Dal personale dell'Amministrazione finanziaria che si avvale della collaborazione della Guardia di Finanza.;d) Dai militari della Guardia di Finanza che si avvalgono della collaborazione dell'Amministrazione finanziaria.;3
"Per quanto concerne ""l'esame dei documenti"" a corredo del trasferimento dei prodotti sottoposti ad accisa quali attività tra le seguenti riguarda?";"a) Gli aspetti quali- quantitativi del prodotto trasferito; indicazione del tempo intercorrente per il trasferimento della merce.";b) Non è afferente al controllo di eventuali reintroduzioni di beni in deposito.;c) Non riguarda la verifica delle variazioni del destinatiario o del luogo di consegna.;d) Nessuna delle precedenti.;1
In quale momento sorge l'obbligazione tributaria per i prodotti sottoposti ad accisa?;a) Al momento della circolazione del prodotto.;b) Solo nel momento della fabbricazione del prodotto.;c) Al momento della fabbricazione di quei prodotti o al momento della loro importazione.;d) Al momento della vendita nel Paese di destinazione.;3
Nell'ambito dei riscontri di coerenza cos'è il riscontro di coerenza esterna?;a) Non interessa le interrogazioni a vari banche dati.;b) Consiste nel confronto tra le risultanze dell'impianto contabile del soggetto ispezionato con ogni genere di dato od elemento materiale o fattuale, fenomenico o contabile acquisiti esternamente all'attività economica oggetto di controllo.;c) Non afferisce a controlli incrociati.;d) Nessuna delle precedenti.;2
"Con l'acronimo ""T.U.A."" si identifica:";a) Il testo delle disposizioni comuni in materia di accertamento delle imposte sui redditi;b) Il testo unico dell'imposta sul valore aggiunto;c) Nessuna delle alternative proposte è corretta;d) il testo unico delle accise.;4
Il carburante agricolo può essere impiegato solo per le attività agricole per le quali è stato richiesto e assegnato?;a) Sì.;b) No, ma limitatamente ad uso privato del titolare del soggetto che ha richiesto il carburante.;c) No.;d) No, ma limitatamente al quantitativo di l 1.000.;1
Nei recinti dei depositi fiscali non possono essere detenuti prodotti alcolici ad imposta assolta...;a) senza l'apposita autorizzazione della GdF.;b) Tranne che per quelli strettamente necessari per il consumo aziendale, stabiliti per quantità e qualità dal competente ufficio dell'Agenzia delle Dogane e dei Monopoli.;c) Eccetto quelli prossimi alla vendita.;d) Senza alcun limite.;2
La scritturazione del registro di carico e scarico dei carburanti per gli impianti di distribuzione stradale è un obbligo?;a) No, non è obbligatorio.;b) Sì, è obbligatorio.;c) Sì, fatta eccezione per gli impianti che presentano meno di 5 colonne di erogazione;d) Nessuna delle alternative proposte è corretta.;2
Chi viene sorpreso con merci estere nascoste sulla persona, per sottrarle alla visita doganale, come viene inquadrato?;a) Rientra tra i sanzionati secondo le norme del L. 212/2000.;b) Può dichiarare sul momento con una memoria scritta quale merce sta trasportando.;c) Rientrante nell'art. 282 del T.U.A.;d) All'interno dell'art. 282 del T.U.L.D., per contrabbando nel movimento delle merci attraverso i confini di terra.;4
Da quale miscela di elementi è composto il gas di petrolio liquefatto?;a) Propano;b) Propano e Butano Esano;c) Butano.;d) Metano ed esano.;2
Il tentativo di sottrazione all'accertamento ed al pagamento dell'accisa sull'alcole e sulle bevande alcoliche è punito con la stessa pena prevista per il reato consumato?;a) Soltanto se il tentativo è commesso all'interno del territorio nazionale.;b) Sì.;c) Falso.;d) Soltanto se il tentativo è commesso al di fuori del territorio nazionale.;2
L'operatore professionale registrato è obbligato a versare l'accisa entro quale termine?;a) Entro il giorno stesso.;b) Entro le 48 ore.;c) Entro il giorno successivo non festivo di arrivo della merce;d) Entro 72 ore.;3
Il gas propano liquido è sottoposto al regime di tassazione?;a) Sì, a tassazione per equivalenza;b) Sì, con aliquota fissa al 33%;c) Solo nei casi previsti;d) Sì.;4
Come vengono documentate dai militari le operazioni di servizio attinenti il controllo presso gli impianti di distribuzione?;a) Attraverso un verbale di operazioni compiute.;b) Attraverso un processo verbale delle giacenze.;c) Attraverso un processo verbale di constatazione e determinazione delle giacenze.;d) Attraverso un verbale di accesso delle giacenze.;3
Il regime del deposito fiscale da quale Amministrazione è autorizzato?;a) Ufficio dell'Agenzia delle Entrate Riscossione, competente per territorio.;b) Ufficio dell'Agenzia delle Dogane, competente per territorio.;c) Comando Provinciale della Guardia di Finanza, competente per territorio.;d) Ufficio Territoriale del Governo, competente per territorio.;2
Ai sensi dell'articolo 39-bis T.U.A. il tabacco trinciato a taglio fino da usarsi per arrotolare le sigarette è assoggettato ad accisa?;a) Si, solo se il valore è maggiore di euro 3,00 al grammo.;b) No.;c) Si.;d) Si, solo se importato.;3
I depositi fiscali che esercitano l'attività di produzione di tabacchi lavorati, in armonia a quanto previsto dal D.M. n. 67/1999, sono obbligati alla tenuta di che registro?;a) Scarico e rimanenze delle materie prime.;"b) Registro di
carico,scarico e rimanenze delle materie prime, dei prodotti semilavorati, dei residui introdotti od estratti dal deposito e dei prodotti finiti.";c) Scarico e registro dei residui introdotti od estratti dal deposito.;d) Scarico e rimanenze delle materie prime, dei residui introdotti od estratti dal deposito e dei prodotti finiti.;2
A quanti kg convenzionali corrisponde la quantità di 1.567 sigarette?;a) 1,567 Kg.;b) 3082 Kg;c) 10567 Kg;d) 1,50670 Kg.;1
Il rimborso dell'accisa indebitamente versata deve essere richiesto, a pena di decadenza, entro quale termine?;a) Dieci anni dalla data di pagamento;b) Trenta anni dalla data del pagamento;c) Due anni dalla data del pagamento;d) Venti anni dalla data del pagamento;3
Il peso di 1000 sigarette è convenzionalmente pari a:;a) 1 kg;b) 0,85 kg;c) 0,25 kg;d) mezzo chilogrammo;1
Come avviene la procedura di determinazione delle giacenze fisiche?;a) Si verificano le scritture contabili dell'impianto.;b) Si misura, mediante asta o bindella metrica, il livello in centimetri del prodotto controllato senza interrompere le operazioni di erogazione.;c) Si interrompono le operazioni di erogazione del prodotto e si misura, mediante asta o bindella metrica, il livello in centimetri del prodotto controllato.;d) Si effettua il controllo dei registri di carico e scarico.;3
L'art. 2 del D.Lgs 504/95 specifica che per i prodotti sottoposti ad accisa l'obbligazione tributaria sorge:;a) al momento della fatturazione.;b) al momento della loro fabbricazione, compresa l'estrazione dal sottosuolo qualora l'accisa sia applicabile, o della loro importazione.;c) al momento del consumo.;d) al momento della esportazione.;3
Quali sono gli adempimenti per il soggetto che intende istituire e gestire un deposito di prodotti liquidi da inalazione?;a) Deve dichiarare l'inizio attività all'ADM e all'Agenzia delle Entrate.;b) Deve presentare una dichiarazione di inizio attività al Comune ove è ubicato il deposito in gestione.;c) Non ci sono particolari formalità da seguire.;d) Deve presentare una domanda all'ADM, la quale entro 30 giorni deve adottare provvedimento di diniego o autorizzazione di quanto richiesto.;4
Quale è il motivo principale dell'introduzione del registro di carico e scarico?;a) E' quello di poter effettuare riscontri di coerenza interna con riguardo ai soli controlli incrociati a monte.;b) E' quello di poter effettuare solo riscontri di coerenza interna con riguardo ai controlli incrociati a valle.;c) E' quello di poter effettuare riscontri di coerenza interna ed esterna, in ogni momento, con riguardo dei controlli incrociati a monte e valle.;"d) E' quello di poter effettuare solo riscontri di coerenza esterna, in ogni momento, con riguardo dei controlli incrociati a monte
e valle.";3
Quante operazioni di misura della temperatura della massa alcolica dovranno essere effettuate per determinare il volume anidro di una miscela idroalcolica pura?;a) 5.;b) 3/4 misurazioni.;c) 1.;d) Almeno 2 misurazioni.;4
Secondo quanto disposto dall'art. 52 T.U.A. , in quale momento viene sottoposta ad accisa l'energia elettrica ?;a) Combacia con il momento in cui viene emessa anche la fattura all'utenza di destinazione.;b) Nel momento in cui prodotti vengono estratti dal sottosuolo.;c) Varia a seconda dell'Ente erogatore della stessa e dalle modalità stabilite dal paese di appartenenza.;d) Nel momento in cui viene fornita al consumatore finale ovvero al momento del consumo per l'energia elettrica prodotta per uso proprio.;4
Le materie prime utilizzate per commettere le violazioni del dettato normativo di cui all'articolo 41 del D.Lgs.n. 504 del 1995:;a) non possono essere confiscate.;b) sono soggette a confisca secondo le disposizioni legislative vigenti in materia doganale.;"c) possono essere
confiscate solo se il reato è commesso in forma associativa e mai negli altri casi.";d) possono essere confiscate solo se ricorrono le aggravanti dell'art. 46 TUA.;2
Secondo la normativa UE, nel settore delle accise, quale aliquota che viene applicata?;a) Quella del Paese in cui il prodotto è fabbricato.;b) Quella del Paese in cui il prodotto è immesso al consumo.;c) Nessuna delle altre alternative proposte è corretta.;d) E' quella dei Paesi in cui il prodotto è sia fabbricato che destinato al consumo.;2
Quali fini possono essere perseguiti attraverso gli accertamenti tecnici di cui al comma 5 dell'art. 18 del T.U.A.?;a) L'amministrazione finanziaria se ne avvale per controllare, anche a fini diversi da quelli tributari, l'osservanza delle disposizioni nazionali o comunitarie.;b) Per l'accertamento del corretto utilizzo del patentino.;c) L'amministrazione finanziaria se ne avvale qualora abbia indizi di produzione clandestina di alcol.;d) Competenza esclusiva della G.di F., al fine di riscontrare anomalie.;1
Il registro di carico e scarico dell'impianto di prodotti petroliferi deve essere tenuto?;a) in litri per i distributori carburanti e per i depositi;b) in chilogrammi per i distributori carburanti e per i depositi;c) in litri per i distributori carburanti e in chilogrammi per i depositi;d) in chilogrammi per i distributori carburanti e in litri per i depositi;3
Il Testo Unico in materia di accise specifica quale è il suo ambito di applicazione territoriale. Quale delle seguenti affermazioni è falsa alla luce dell'art.1?;"a) Per ""Stato"" o ""territorio dello Stato"" si intende il territorio della Repubblica italiana.";b) Le operazioni effettuate in provenienza/ destinazione della Repubblica di San Marino devono essere perfezionate presso gli uffici sammarinesi. Nel caso specifico non vengono prese in considerazione le disposizioni finanziarie previste dalla Convenzione di amicizia e buon vicinato.;c) Le operazioni effettuate in provenienza/destinazione del Principato di Monaco sono considerate come provenienti/destinate alla Repubblica francese.;"d) Per ""Comunità"" o ""territorio della Comunità"" si intende il campo di applicazione del Trattato istitutivo della Comunità economica europea, con delle specifiche esclusioni per territori di alcuni Paesi.";4
In merito all'art. 40 T.U.A., che riguarda la sottrazione all'accertamento o al pagamento dell'accisa sui prodotti energetici, quale affermazione è giusta? ;a) La fattispecie del menzionato articolo non trova spazio nella concezione di contrabbando, ragion per cui non è applicabile il disposto normativo dell'art. 266 lett c) del c.p.p. ;b) E' ammissibile, ai sensi dell'art. 266 lett. e) c.p.p., l'autorizzazione alle intercettazioni di conversazioni o comunicazioni per il reato previsto dall'art. 40, in quanto lo stesso, consistendo nella sottrazione di prodotti energetici all'accertamento e al pagamento dell'accisa, deve ritenersi compreso nei delitti di contrabbando (Cass., sez. III pen., 22 gennaio 2018, n. 2418).;"c) Dopo le modifiche apportate dal d.lgs 48/2010, nessuna disposizione normativa espressamente considera ""contrabbando"" anche i prodotti energetici, carburanti e oli minerali sottratti all'accertamento o al pagamento dell'accisa; per tale reato si rileva, quindi, l'impossibilità di essere autorizzati ad effettuare intercettazioni. ";d) Nessuna risposta è corretta.  ;4
I fiammiferi di produzione nazionale sono sottoposti ad imposta di fabbricazione?;a) Sì, come stabilito dall'art. 62 bis del TUA.;b) No, è stata abolita, a decorrere dal 1° gennaio 2015, l'imposta di fabbricazione sui fiammiferi con l'abrogazione degli articoli 62-bis e 62-ter del decreto legislativo 26 ottobre 1995, n. 504.;c) Sì, mentre quelli di provenienza comunitaria vi sono sottoposti.;d) Nessuna alternativa è corretta.;2
Il tabacco da fiuto rientra tra i tabacchi lavorati?;a) Sì, rientra nelle categorie individuate dall'art. 39-bis del TUA.;b) No, è una categoria a sé stante.;c) Nessuna alternativa è corretta.;d) Solo se prodotto all'estero.;1
Tre persone si associano al fine di fabbricare clandestinamente bevande alcoliche. Ognuno di loro verrà punito per il solo fatto dell'associazione?;a) No, è necessaria la commissione di atti ricompresi nell'attività esecutiva.;b) Sì, ma solo se c'è la conseguente commissione del reato di fabbricazione clandestina.;c) Solo in alcuni casi ben delineati.;d) Si.;4
Il tabacco da masticare rientra nell'art. 39-bis del TUA?;a) Nessuna risposta è corretta.;b) No, non essendo sottoposto ad accisa.;"c) Solo quando si presenta nella forma di ""tavolette"".";d) Sì.;4
L'art. 40 del T.U.A. impone un limite minimo quantitativo per la sanzione pecuniaria?;a) No, non sono stabiliti vincoli in proposito.;b) Sì, la multa non può essere inferiore a 7.746 euro.;c) Sì, minimo 12mila euro.;d) Nessuna alternativa è corretta.;2
Come si effettua la liquidazione dell'accisa per gli ammanchi?;a) Si applicano le aliquote vigenti al momento della fabbricazione del prodotto.;b) Si applica una aliquota fissa per gli ammanchi, stabilita con decreto ministeriale di anno in anno.;c) Si applicano le aliquote vigenti al momento della constatazione.;d) Si applicano le aliquote vigenti al momento in cui gli ammanchi si sono verificati o, se tale momento non può essere determinato, quelle vigenti nel momento della loro constatazione.;4
Lo svincolo irregolare di prodotti sottoposti ad accisa...;a) Non ci sono alternative corrette.;b) Non è assimilato all'immissione in consumo.;"c) E' assimilato
all'immissione in consumo, poiché sussiste l'esigenza di prevenire l'evasione dell'imposta.";d) Comporta una ammenda.;3
Chi utilizza un gruppo elettrogeno di soccorso di potenza inferiore a 200kW:;a) Non è tenuto agli obblighi ed agli adempimenti previsti dal T.U.A.;b) Dovrà pagare le accise sull'energia prodotta.;c) Rientra nel catalogo previsto dall'art. 53 del T.U.A.;d) Nessuna risposta è corretta.;1
Un soggetto privato può produrre liquore per uso proprio?;a) No, è una attività vietata.;b) Sì, purchè il prodotto diventi oggetto di vendita.;c) Nessuna alternativa è corretta.;d) Sì, con impiego di alcole ad imposta assolta e a patto che i prodotti non siano oggetto di vendita.;4
Chi si occupa delle attività di vigilanza e di controllo sulla fabbricazione, sul trasporto, sulla distribuzione e sulla vendita dei tabacchi lavorati?;a) Le attività sono affidate alla Guardia di Finanza, con modalità determinate con decreto del Ministro dell'Economia e delle Finanze, sentiti il Comando Generale del Corpo e l'Agenzia delle Dogane e dei Monopoli.;b) Le attività sono affidate alla Guardia di Finanza, con modalità determinate con decreto del Ministro dell'Economia e delle Finanze, sentito il Comando Generale del Corpo.;c) Le attività sono affidate all'Agenzia delle Dogane e dei Monopoli, con modalità determinate con decreto del Ministro dell'Economia e delle Finanze.;d) Le attività sono affidate alla Guardia di Finanza, con modalità determinate con decreto del Ministro dell'Economia e delle Finanze, sentita l'Agenzia delle Dogane e dei Monopoli.;1
La licenza di cui all'art. 25 comma 4 T.U.A. può essere negata al soggetto nei cui confronti, nel quadriennio antecedente la richiesta sia stata pronunciata sentenza irrevocabile di condanna (ex art. 648 c.p.p.), ovvero sentenza definitiva di applicazione della pena su richiesta (ex art. 444 c.p.p.) per violazioni costituenti delitti, in materia di accise, punibili con la reclusione non inferiore nel minimo ad un anno?;a) La licenza in questione deve essere negata.;b) Si, la discrezionalità sulla possibilità di negazione della licenza interviene con provvedimento del Direttore dell'Agenzia delle Entrate.;c) La licenza può essere negata per violazioni costituenti delitti, in materia di accise, punibili con la reclusione non inferiore nel minimo ad anni due.;d) La licenza può essere negata per violazioni costituenti delitti, in materia di accise, punibili con la reclusione non inferiore nel minimo ad anni tre.;1
