Tra i poteri rientranti al comma 2 dell'art. 18 del T.U.A. quali facoltà, tra le seguenti, sono espressamente previste per il Corpo della Guardia di Finanza?;a) Nei depositi fiscali e presso i destinatari registrati applica bolli e suggelli agli apparecchi e ai meccaniscmi installati.;b) Presso i depositi fiscali di tabacchi abilitati all'attività di fabbricazione dei tabacchi lavorati, effettua in via permanente, la vigilanza fiscale.;c) Facoltà di accedere liberamente, in qualsiasi momento, nei depositi e negli impianti dove vengono fabbricati, trasformati o utilizzati prodotti sottoposti ad accisa o dove è detenuta la documentazione contabile per eseguirvi ricerche, verificazioni, ispezioni e riscontri.;d) Nei depositi fiscali sono eseguiti solo inventari periodici.;3
In merito al servizio di vendita al dettaglio di tabacchi lavorati, nel caso di istituzione di nuova rivendita ordinaria, qual è la distanza minima che dev'esserci con le altre rivendite preesistenti se il Comune di riferimento ha un numero superiore a 100.000 abitanti?;a) 150 m.;b) 250 m.;c) 400 m.;d) 50 m.;2
L'art 23 comma 3 del T.U.A., dice che in merito ai depositi fiscali di prodotti energetici...;a) E' vietato l'utilizzo dei prodotti petroliferi ad accisa assolta.;b) Non è vietata la detenzione dei prodotti petroliferi ad imposta assolta, purché siano debitamente dichiarati.;c) Valgono le stesse regole dei prodotti alcolici intermedi.;d) E' vietata la detenzione, nei relativi recinti, di prodotti petroliferi ad imposta assolta, con la sola eccezione di quelli destinati al funzionamento degli impianti, entro i limiti qualitativi e quantitativi autorizzati dall'Agenzia delle Dogane.;4
E' possibile, nel corso dei controlli sulla circolazione dei prodotti sottoposti ad accisa, prelevare campioni del prodotto?;a) No, il Testo Unico non lo prevede.;b) Sì, con l'autorizzazione del Comandante di Reparto.;c) Sì, con autorizzazione della A.G.;d) Sì.;4
Gli stabilimenti ove avviene la produzione di acquaviti e distillati sono sottoposti alle disposizioni di carattere generale sul regime del deposito fiscale?;a) No.;b) Sì, ma dipende dalla gradazione alcolica dei prodotti.;c) Sì, ma dipende dal volume di prodotto gestito dagli stabilimenti.;d) Sì.;4
Birra, vino e alcole etilico sono ottenuti in impianti di lavorazione gestiti in...;a) Regime di deposito agricolo-commerciale.;b) Regime di deposito professionale.;c) Regime di deposito fiscale.;d) Regime di deposito giudiziario temporaneo.;3
Per quanto concerne i depositi fiscali, nell'ambito dei tabacchi lavorati, l'esercizio è subordinato a:;a) Autorizzazione del Comandante provinciale della GdF.;b) Adozione di un codice accisa omologato.;c) Autorizzazione con provvedimento del Prefetto.;d) Adozione di un provvedimento di autorizzazione da parte dell'Amministrazione Autonoma dei Monopoli dello Stato con contestuale attribuzione di un codice accisa.;4
In cosa consistono i cali naturali in ambito accise?;a) Nessuna risposta è corretta.;b) In perdite che si verificano per la giacenza delle merci nei depositi intermedi.;c) In cali di prodotto dati dal fatto che non sono state seguite le norme di conservazione.;d) In perdite di peso o di volume delle merci, subite nel tempo in relazione a fenomeni chimici, fisici o biologici.;4
In merito all'attività ispettiva svolta nei confronti di un impianto di distribuzione stradale nel caso in cui le deficienze riscontrate superino i cali previsti per legge, quali conseguenze, ai fini I.R.Pef. e I.R.E.S., sono previste?;a) Si procederà a comminare una sanzione amministrativa fissa pari ad € 1.500.;b) Ai fini delle imposte indirette, trattandosi di annualità aperta, si procederà alla sola segnalazione al competente Ufficio delle e Monopoli dell'ammontare dei ricavi non documentati, per il derivante recupero a tassazione, qualora la parte non provvederà ad inserirlo nella dichiarazione dei redditi.;c) Ai fini delle imposte indirette, trattandosi di annualità aperta, si procederà alla sola segnalazione al competente Ufficio dell'Agenzia delle Entrate dell'ammontare dei ricavi non documentati, per il derivante recupero a tassazione, qualora la parte non provvederà ad inserirlo nella dichiarazione dei redditi.;d) Ai fini delle imposte sui redditi, trattandosi di annualità aperta, si procederà alla sola segnalazione al competente Ufficio dell'Agenzia delle Entrate dell'ammontare dei ricavi non documentati, per il derivante recupero a tassazione, qualora la parte non provvederà ad inserirlo nella dichiarazione dei redditi.;4
Quando è concesso l'abbuono dell'accisa nel caso in cui ci siano delle perdite di prodotti in regime sospensivo che sono legate alla natura stessa dei prodotti e verificatesi durante i processi di lavorazione o di fabbricazione di quei prodotti, nei casi in cui sia già sorta l'obbligazione tributaria?;a) Con apposita istanza all'Agenzia delle Entrate.;b) Solo entro i limiti dei cali tecnicamente ammissibili, determinati con decreto del Ministro dell'Economia e delle Finanze.;c) L'abbuono dell'accisa è sempre concesso.;d) Non è mai concesso l'abbuono dell'accisa.;2
Quale documentazione è necessaria per lo svolgimento dell'attività propria del distributore di carburante?;a) Non necessita il certificato prevenzione incendi.;b) Licenza di esercizio.;c) Comunicazione all'Agenzia delle Entrate.;d) Non necessitano documenti costituenti il carico e lo scarico contabile.;2
Da cosa è composta l'Amministrazione Finanziaria, menzionata nel D.Lgs. 504/1995?;a) Dall'insieme di tutti i militari della Guardia di Finanza preposti agli specifici controlli in materia di imposizione indiretta.;b) Si intende l'insieme di tutti i funzionari dell'Agenzia delle Dogane.;c) Comprende gli Organi centrali o periferici dell'Agenzia delle Dogane ovvero dell'Amministrazione Autonoma dei Monopoli di Stato.;d) Fa riferimento all'art. 2, comma 3, lett f) e si intende l'insieme di tutti i depositari autorizzati, responsabili della gestione del deposito.;3
Il regime del deposito fiscale è previsto anche per le raffinerie?;a) Solo per le raffinerie superiori ai 1000 mq.;b) Sì, è previsto.;c) No, mai.;d) Solo su specifica richiesta del depositario.;2
Per quale attività NON può essere utilizzato il gasolio agricolo?;a) Garantire il funzionamento delle macchine per l'irrigazione.;b) Alimentare il serbatoio di macchine agricole.;c) Garantire il funzionamento degli impianti di riscaldamento delle serre.;d) Garantire il funzionamento della propria vettura.;4
Nell'ambito dei riscontri di coerenza, in cosa consiste il riscontro di coerenza esterna?;a) Non interessa le interrogazioni a varie banche dati.;b) Consiste nel confronto tra le risultanze dell'impianto contabile del soggetto ispezionato con ogni genere di dato od elemento materiale o fattuale, fenomenico o contabile acquisiti esternamente all'attività economica oggetto di controllo.;c) Non afferisce a controlli incrociati.;d) Nessuna delle alternative è corretta.;2
Cosa si intende per fabbricazione clandestina di alcole e bevande alcoliche?;a) Nessuna definizione è corretta.;b) E' l'attività eseguita con apparecchiature non permesse dalla normativa comunitaria.;"c) E' l'attività svolta in ""nero"" e in modo parallelo rispetto all'attività principale, seppur svolta con apparecchi e strumentazione a norma.";d) E' l'attività eseguita in locali o con apparecchi non previamente denunciati o verificati, costruiti od alterati in modo che il prodotto possa essere sottratto all'accertamento.;4
Chi è l'Organo accertatore dell'imposta nel caso di sugar tax?;a) Il Prefetto.;b) Agenzia della Riscossione.;c) il Comune.;"d) L'Agenzia delle Dogane
e Monopoli.";4
In quale caso il titolare del deposito fiscale di prodotti energetici può presentare, all'Agenzia delle Dogane e dei Monopoli, istanza di rateizzazione del debito di imposta relativo alle immissioni in consumo effettuate nel mese precedente alla predetta scadenza?;a) Nel caso in cui si trovi in condizioni oggettive di temporanea di difficoltà.;b) Nel caso in cui abbia accumulato un debito di imposta inferiore a € 1.500,00.;c) Nel caso in cui abbia accumulato un debito di imposta superiore a € 1.500,00.;d) Nessuna delle alternative è corretta.;1
Il tabaccaio che vende a minorenni prodotti contenenti nicotina:;a) Va incontro alla chiusura dell'attività.;b) Commette un reato.;c) Incorre nella sanzione pecuniaria e alla sospensione per quindici giorni della licenza dell'esercizio dell'attività.;d) Nessuna delle alternative è corretta.;3
In che modo vanno documentate le operazioni di servizio attinenti il controllo presso gli impianti di distribuzione?;a) Attraverso un verbale di operazioni compiute.;b) Attraverso un processo verbale delle giacenze.;c) Attraverso un processo verbale di constatazione e determinazione delle giacenze.;d) Attraverso un verbale di accesso delle giacenze.;3
Come viene considerato un prodotto sottoposto ad accisa che viaggia con un documento falso?;"a) Si presume di illecita provenienza, per cui si applicano al trasportatore
e allo speditore le pene previste per la sottrazione del prodotto all'accertamento o al pagamento dell'imposta.";b) Si presume di illecita provenienza, si applicano al trasportatore le pene previste per la sottrazione del prodotto all'accertamento o al pagamento dell'imposta.;c) Si presume di illecita provenienza, si applicano allo speditore le pene previste per la sottrazione del prodotto all'accertamento o al pagamento dell'imposta.;d) Si presume di illecita provenienza, ma sono esclusi i prodotti destinati ad usi esenti o agevolati.;1
Quale tra le seguenti alternative deve essere riportata nelle pagine del registro di Carico?;a) Il colore dei prodotti.;b) La quantità dei prodotti.;c) Il nome biochimico dei prodotti.;d) La composizione chimica dei prodotti.;2
Relativamente alla denaturazione dell'alcole con denaturante generale dello Stato, occorre evidenziare che...;a) Tale tipologia di denaturazione riguarda alcoli che hanno subito una miscelazione con altre sostanze, compresa eventuale diluizione con acqua.;b) Dopo la denaturazione sono previste le operazioni di diluizione e di miscelazione.;c) Tale tipologia di denaturazione riguarda alcoli greggi che hanno già subito una miscelazione con altre sostanze.;d) Le operazioni di denaturazione devono essere effettuate esclusivamente presso distillerie, opifici di rettificazione, magazzini sussidiari di fabbrica, depositi doganali e magazzini di commerciante all'ingrosso di alcole etilico.;4
E' prevista la possibilità di ricorso alle intercettazioni per il delitto di contrabbando?;a) Tale delitto non è mai stato reputato così lesivo degli interessi finanziari da essere annoverato nell'ambito delle intercettazioni.;b) Sì, è espressamente previsto nell'art. 266 lett. e) del c.p.p.;c) No, non è previsto se non nelle sue forme più complesse o se commesso da una organizzazione criminale.;d) No, le intercettazioni sono previste solo nel caso di contrabbando interno di prodotti energetici.;2
Per quali tipologie di prodotti si può rilevare di frequente il fenomeno dell'evasione effettuato attraverso la distrazione delle merci dall'uso dichiarato verso altri impieghi?;a) Per i prodotti che hanno l'aliquota al 33%.;b) Per i prodotti esenti da accisa o sottoposti ad aliquota agevolata, che sono dirottati verso impieghi esclusi dal beneficio fiscale.;c) Per i prodotti di origine extra-UE.;d) Nessuna risposta è corretta.;2
In caso di perdita irrimediabile di prodotti che si trovano in regime sospensivo ai fini delle accise, quando è concesso l'abbuono della relativa imposta?;a) Quando il soggetto obbligato provi che la perdita dei prodotti sia avvenuta solo per colpa grave.;b) Quando il soggetto obbligato provi che la perdita dei prodotti sia avvenuta per caso fortuito o per forza maggiore.;c) Quando il soggetto obbligato provi che la perdita dei prodotti sia avvenuta solo per dolo eventuale.;d) Quando il soggetto obbligato provi che la perdita dei prodotti sia avvenuta solo per dolo specifico.;2
Nell'ambito dei controlli su strada aventi ad oggetto il G.P.L, si può effettuare il campionamento del prodotto?;a) Sì, qualora sia indispensabile ai fini del controllo. Le operazioni vanno svolte necessariamente all'interno dell'impianto munito dei requisiti necessari per operare in condizione di sicurezza.;b) No, non è mai possibile, a causa delle caratteristiche intrinseche al prodotto in questione.;c) Sì, è sempre possibile chiedendo il supporto dei Carabinieri.;d) Nessuna risposta è sbagliata.;1
Cosa prevede la ricognizione dell'impianto?;a) Attività di accesso per esecuzione di attività ispettiva.;b) Esame della documentazione.;"c) Identificazione di impianti, serbatoi, apparecchiature e strumenti installati; controllo della taratura dei serbatoi; esamina dei diagrammi di flusso; controllo del regolare funzionamento degli eventuali sistemi di gestione informatizzata.";d) Nessuna delle alternative è corretta.;3
La Guardia di Finanza svolge vigilanza:;a) Tecnica.;b) Fissa con posti di blocco negli opifici.;c) Sia statica che dinamica, che si concretizza con attività ispettive di verifica e controllo.;d) Nessuna delle alternative è corretta.;3
In ambito di imposizione accise, quale è l' aliquota che viene applicata?;a) E' quella del Paese in cui il prodotto è immerso al consumo.;b) E' quella del Paese in cui il prodotto è fabbricato.;c) Nessuna delle alternative è corretta.;d) E' quella dei Paesi in cui il prodotto è sia fabbricato che destinato al consumo.;1
Quali, tra i seguenti, sono soggetti investiti dei poteri ispettivi in materia di accise?;a) La Guardia di Finanza e l'Amministrazione Autonoma dei Monopoli di Stato.;b) Solo l'Amministrazione dell'Agenzia delle Dogane.;c) Solo la Guardia di Finanza.;d) Solo l'Amministrazione Finanziaria da individuarsi negli organi centrali e periferici dell'Agenzia delle Dogane.;1
Quali sono, tra i seguenti, documenti funzionali e prioritari allo svolgimento dell'attività del distributore di carburanti?;a) Comunicazione all'Agenzia delle Entrate.;b) Non necessita il certificato prevenzione incendi.;c) Licenza di esercizio.;d) Non necessitano documenti costituenti il carico e lo scarico contabile.;3
Quali sono, tra i seguenti, i poteri esercitabili dagli Organi preposti al controllo sulla circolazione dei prodotti di cui al Testo Unico sulle Accise?;a) Perquisire il solo mezzo;b) Effettuare ricerche sui mezzi di trasporto impiegati, procedere al prelevamento di campioni, apporre sigilli al carico per esigenze di tutela fiscale;c) Effettuare ricerche sui mezzi di trasporto impiegati e procedere al prelevamento di campioni;d) Perquisire il mezzo di trasporto ed il suo conducente;2
I depositi fiscali autorizzati sono obbligati a tenere la contabilità dei prodotti detenuti e movimentati nel deposito fiscale?;a) Sono obbligati alla compilazione del solo registro di carico e scarico;b) Sì, sempre;"c) Sono obbligati alla
compilazione del solo
registro di magazzino";d) No, non è necessario;2
A quale regime in materia di accisa devono rispondere gli impianti di produzione di alcole?;a) Deposito fiscale;b) Deposito Prodotti Agricoli;c) Deposito professionale;d) Deposito giudiziario;1
Beneficia di sgravi fiscali la produzione del biodiesel?;a) No;b) Sì, solo quello destinato ad un Paese estero;c) Sì, solo quello prodotto nelle Regioni autonome;d) Sì, sono disciplinati all'art.22-bis del TUA;4
"In cosa si sostanziano i ""controlli su strada"" in materia di attività di controllo sulla circolazione ai fini del contrasto alle frodi nel settore delle accise?";a) Non comportano eventuale apposizione di sigilli al carico.;b) Non deve interessare assolutamente sulla ricognizione del mezzo di trasporto impiegato ed eventuali ricerche sullo stesso.;c) Non riguarda il rilevamento dei trasporti ritenuti maggiormente a rischio.;"d) Dovranno fondarsi sulle fasi di esame dei documenti posti a corredi delle merci trasferite, alla verifica della corrispondenza tra le quantità trasportate e le risultanze emergenti dalla documentazione accompagnatoria,
eventuali prelievi di campioni.";4
"Che cosa si intende per ""calo""?";a) Corrisponde ad un aumento di peso o di volume.;b) Nessuna delle alternative è corretta.;c) La diminuzione di peso o di volume di carburante che avviene durante la lavorazione, il trasporto o la permanenza nei serbatoi.;d) È la differenza tra il peso iniziale prima della lavorazione ed il peso finale dopo il trasporto e la permanenza nei serbatoi.;3
Quale Ente/Agenzia/Reparto è competente per l'applicazione delle sanzioni amministrative concernenti le violazioni in materia di accise di cui al D.Lgs. 504/1995?;"a) Il Comando Regionale
della Guardia di Finanza,
competente per territorio.";"b) Il Comando Provinciale
della Guardia di Finanza,
competente per territorio.";c) L'Agenzia delle Dogane e dei Monopoli - Direzione Regionale, competente per territorio.;d) L'Ufficio Territoriale del Governo, competente per territorio.;3
"Cosa s'intende, tra i seguenti, con l'acronimo ""T.U.A.""?";a) Nessuna delle alternative proposte è corretta;b) Il testo unico dell'imposta sul valore aggiunto;c) Testo Unico delle Accise;d) Il testo delle disposizioni comuni in materia di accertamento delle imposte sui redditi;3
"In materia di circolazione dei prodotti sottoposti ad accisa in merito ai controlli sostanziali su strada a cosa afferisce l'attività di ""ricognizione del mezzo di trasporto""?";a) Sola verifica della corrispondenza tra quantità trasportate e quelle risultanti dalla documentazione accompagnatoria.;b) Solo esame dei documenti.;c) I militari dovranno accertarsi dell'idoneità del mezzo a trasferire prodotti sottoposti ad accise in merito alla stima di pericolosità dei prodotti energetici e individuazione di eventuali meccanismi impiegati per costituzione di scorte occulte.;d) Solo prelievo di campioni.;3
E' previsto l'abbuono dell'imposta in caso di perdita o di distruzione di prodotti che si trovano in regime sospensivo dell'accise?;a) No, mai.;b) Sì, ma solo quando l'abbuono concesso è nell'ordine del 65% dell'imposta dovuta.;c) Sì, sempre.;d) Sì quando il soggetto obbligato provi che la perdita o la distruzione dei prodotti è avvenuto per caso fortuito o per motivi di forza maggiore.;4
"Cosa prevede il principio della ""tassazione nel paese di destinazione""?";a) Che l'imposta è dovuta per il 30% nel Paese di fabbricazione del prodotto e per il 70% nel Paese di immissione al consumo.;b) Che venga applicata la sovrimposta di confine nel Paese UE in cui avverrà l'immissione al consumo.;c) Che è il Paese di destinazione dei prodotti che ha la facoltà di applicare la sovrimposta di confine.;d) Che l'imposta è dovuta nel Paese UE in cui avviene l'immissione al consumo.;4
In caso di deposito fiscale, quali figure rivestono il ruolo di soggetti passivi delle accise?;a) Esclusivamente il titolare del deposito da cui avviene l'immisione al consumo.;b) In solido, tutti i titolari dei depositi fiscali del Paese di destinazione attraverso i quali la merce è circolata.;c) Il trasportatore dei prodotti.;d) Titolare del deposito fiscale dal quale avviene l'immissione al consumo e, in solido, il soggetto garante dell'imposta e ogni soggetto nei cui confronti si verifichino i presupposti di esigibilità.;4
Cosa ha previsto il D.L. 34/2019, convertito con modificazioni dalla L. 58/2019 (cd. Decreto crescita)?;a) Ha reintrodotto l'obbligo di denuncia fiscale per la vendita dei prodotti alcolici, come previsto dall'articolo 29 comma 2 del T.U.A.;b) Ha abolito l'obbligo di denuncia fiscale per la vendita dei prodotti alcolici.;c) Ha introdotto una deroga all'obbligo di denuncia fiscale per la vendita dei prodotti alcolici ex art. 29 comma 2 del T.U.A.;"d) Ha parzilmente
modificato l'art. 29 comma 3 del T.U.A.";1
In ambito di accise, perché è intervenuta la legislazione comunitaria?;a) Per armonizzare lo specifico comparto impositivo, di esclusiva competenza della Comunità europea.;b) Per garantire un quadro comune minimo per la regolazione degli interessi generali, lasciando ai singoli stati la determinazione dei profili di interesse, secondo il principio di sussidiarietà.;c) Perché insieme ad IVA e dazi doganali, si tratta di materia di interesse esclusivo della Comunità europea.;d) Per definire l'applicazione delle aliquote.;2
Quale tipo di vigilanza effettuano i militari del Corpo nel settore delle accise e di altre imposte indirette sulla produzione e consumo?;a) Vigilanza dei depositi.;b) Esclusivamente vigilanza dinamica sulla circolazione su strada delle merce.;c) In via principale vigilanza con servizi fissi presso gli opifici.;d) Sia una vigilanza statica che dinamica, che si concretizza con attività ispettive di verifica e controllo.;4
Quale delle seguenti agenzie fiscali è competente quando sorgono controversie relative alla classificazione dei prodotti sottoposti ad accisa?;a) L'Agenzia delle Entrate.;b) Nessuna delle risposte è corretta.;c) L'Agenzia delle Entrate- Riscossione.;d) L'Agenzia Dogane e Monopoli.;4
Come si effettua la liquidazione dell'accisa?;a) Applicando alla quantità di prodotto l'aliquota d'imposta vigente al momento della liquidazione dell'imposta.;b) Applicando alla quantità di prodotto l'aliquota d'imposta vigente alla data di immissione in consumo del prodotto.;c) Applicando alla quantità di prodotto l'aliquota d'imposta vigente al momento dell'ingresso del prodotto nel territorio dello Stato.;d) Nessuna delle precedenti.;2
Per i militari della GdF l'accesso, annoverato nell'art. 18 comma 2 TUA, da cosa è legittimato?;a) Nessuna delle risposte è corretta.;b) è sempre legittimo, purchè avvenga insieme ad un funzionario dell'Agenzia delle Dogane.;c) Dal rispetto delle disposizioni dettate dalla L. 212/2000.;d) Dall'esistenza di un ordine specifico, riportato nel foglio di servizio da esibire al contribuente, secondo le direttive generali in tema di accessi fiscali, riportati della circolare 1/2018.;4
"Che cosa si intende con il termine ""calo""?";a) Corrisponde ad un aumento di volume.;b) Nessuna delle altre alternative proposte è corretta.;c) La diminuzione di peso/volume di carburante che avviene durante lavorazione,trasporto o permanenza nei serbatoi.;d) È la differenza tra il peso iniziale prima della lavorazione ed il peso finale dopo il trasporto e la permanenza nei serbatoi.;3
E' previsto l'abbuono dell'imposta in caso di perdita/distruzione di prodotti che si trovano in regime sospensivo dell'accisa?;a) Sì, sempre.;b) Sì, ma solo quando l'abbuono concesso è nell'ordine del 65% dell'imposta dovuta.;c) Sì,quando il soggetto obbligato provi che la perdita/distruzione dei prodotti è avvenuto per caso fortuito o forza maggiore.;d) No, mai.;3
"I militari della GdF, ex art. 18 TUA, possono accedere ""liberamente"" in un luogo per effettuare le operazioni richieste dallo specifico servizio. L'avverbio in questione:";a) Consente ai militari di operare in deroga alla circolare 1/2018.;"b) Sottolinea la necessità di accedere tempestivamente
e senza specifico ordine autorizzativo.";c) Consente ai militari operanti di valutare autonomamente i presupposti e procedere poi con l'attività ispettiva.;d) è da intendersi sempre in relazione alle effettive esigenze d'indagine sul luogo, il cui accesso va obbligatoriamente autorizzato con ordine specifico riportato sul foglio di servizio.;4
L'accesso può essere qualificato quale atto amministrativo avente natura autoritativa. Lo stesso, per i militari della GdF, è prodromico:;a) All'esecuzione di attività di polizia giudiziaria.;b) Alla necessità di eseguire verificazioni, riscontri, invetari, ispezioni e ricerche nonché di esaminare registri e documenti.;c) Alla mera rilevazione dell'effettiva condizione dei luoghi e degli impianti da sottoporre a controllo.;d) All'esecuzione di attività di collabortazione con le Dogane.;2
"In cosa consiste il c.d. ""tabacco da fiuto""?";a) Equivale alle sigarette.;b) Tabacco trinciato a taglio.;c) Tabacco da masticare.;d) Tabacco in polvere o in grani preparato per essere fiutato ma non fumato.;4
La GdF può eseguire verifiche nei confronti di impianti di produzione e depositi, ma anche nei confronti di altri impianti e soggetti, tra cui quelli elencati nell'art. 53 del TUA. Di chi si tratta?;a) Dei depositi intermedi.;b) Dei depositi privati, industriali ed agricoli con capacità fino a 25 mc.;c) Dei distributori stradali di carburante.;d) Dei soggetti obbligati al pagamento dell'energia elettrica.;4
A quanto ammonta il totale della cauzione dovuta per il deposito fiscale di bevande alcoliche confezionate e munite di contrassegno di stato?;a) Non c'è nessuna cauzione.;"b) La cauzione deve essere
prestata in misura pari alla
metà dell'accisa gravante.";c) La cauzione deve essere prestata in misura pari all'ammontare dell'accisa gravante.;d) La cauzione deve essere prestata in misura pari ad un terzo dell'accisa gravante.;3
Ci sono dei requisiti per accedere al beneficio sul carburante agricolo?;a) Il soggetto economico deve essere iscritto nel Registro delle Dogane.;b) No, basta che sia un soggetto economico conosciuto dalle Autorità locali.;c) Sì, basta che il soggetto economico possegga un terreno agricolo come da documentazione aziendale.;d) Sì, ci sono una serie di requisiti, tra i quali ,per esempio, il fatto che il soggetto economico deve essere iscritto nel Registro Imprese Agricole della Camera di Commercio.;4
Quali sono i soggetti investiti di poteri ispettivi in materia di accise?;a) Solo la Guardia di Finanza.;b) Solo l'Amministrazione dell'Agenzia delle Dogane.;c) La Guardia di Finanza e l'Agenzia Dogane e Monopoli.;d) Solo l'Amministrazione Finanziaria da individuarsi negli organi centrali e periferici dell'Agenzia delle Dogane.;3
