Non è sottoposta ad accisa l'energia elettrica:;a) Utilizzata per l'attività di produzione di elettricità.;b) Utilizzata per l'impianto e l'esercizio delle linee di trasporto urbano e interurbano.;c) Utilizzata per l'impianto e l'esercizio delle linee ferroviarie adibite al trasporto di merci e passeggeri.;d) Prodotta da gruppi elettrogeni azionati da gas metano biologico.;4
E' vero che per l'esercizio di un deposito fiscale è necessario il rilascio di una licenza fiscale da parte del comune,sede del deposito stesso?;a) No, è rilasciata dalla SIAE.;b) Sì.;c) No, è rilasciata dall'Ufficio delle Dogane prima dell'inizio dell'attività.;d) No, è rilasciata dalla Camera di Commercio.;3
E' previsto lo svolgimento di un'attività di vigilanza fiscale saltuaria presso i depositi abilitati alla fabbricazione di tabacchi lavorati?;a) Non è prevista alcuna forma di vigilanza.;b) Si, come previsto dall'art. 18 comma 1-bis del T.U.A..;c) Si, l'art. 18 comma 1-bis del T.U.A. dispone un'attività di vigilanza fiscale da espletare con modalità dinamiche da parte dei militari della Guardia di Finanza.;d) No, l'art. 18 comma 1- bis del T.U.A. dispone un'attività di vigilanza fiscale permanente da parte dell'Amministrazione Finanziaria che si avvale della collaborazione dei militari della Guardia di Finanza.;4
Per quale attività è necessario operare in regime di deposito fiscale?;a) La fabbricazione dei prodotti non soggetti ad accisa che avviene in un opificio industriale;b) La fabbricazione dei prodotti soggetti ad accisa che avviene in un opificio industriale;c) permettere al titolare la spedizione dei prodotti sottoposti ad accisa;d) il deposito fiduciario sussidiario di fabbrica;2
Ai fini delle accise, può l'Amministrazione finanziaria esonerare dall'obbligo di cauzione le ditte affidabili e di notoria solvibilità?;a) No;b) Solo su autorizzazione della dogana;c) Sì.;d) Solo su autorizzazione della Camera di Commercio;3
In quale misura il depositario è obbligato a prestare la cauzione?;a) Del 10% dell'imposta che grava sulla quantità massima di prodotti detenuti nel deposito fiscale;b) Del 50% dell'imposta che grava sulla quantità massima di prodotti detenuti nel deposito fiscale;c) Del 20% dell'imposta che grava sulla quantità massima di prodotti detenuti nel deposito fiscale;d) Del 30% dell'imposta che grava sulla quantità massima di prodotti detenuti nel deposito fiscale;1
E' vero che la produzione di biodiesel beneficia di sgravi fiscali?;a) Sì, sono disciplinati all'art.22-bis del TUA;b) Sì, solo quello destinato ad un Paese estero;c) Sì, solo quello prodotto nelle Regioni autonome;d) No;1
Il gasolio commerciale può essere utilizzato in attività di trasporto di persone?;a) Si.;b) Si, solo con mezzi euro 4 o superiori.;c) No, eccetto per attività industriali.;d) No.;1
In cosa consiste l'accesso da parte della GdF?;a) Consiste nel potere di entrare in un luogo, con il consenso di chi ne ha la disponibilità, al fine di ispezionare i registri e i documenti utili per le operazioni di servizio.;b) Consiste nel potere di entrare in un luogo, con il consenso di chi ne ha la disponibilità e la sua presenza per tutta la durata delle operazioni di servizio.;c) Consiste nel potere di entrare in un luogo e di permanere per il tempo necessario per effettuare le operazioni di servizio, con la presenza costante della parte.;d) Consiste nel potere di entrare in un luogo e di soffermarvisi, anche senza consenso di chi ne ha la disponibilità, al fine di effettuare tutte le operazioni richieste dallo specifico servizio.;4
Quali caratteristiche definiscono la birra affinché essa rientri nel novero dei prodotti sottoposti ad accisa?;"a) Deve essere un prodotto dato dalla miscela di birra
e bevande non alcoliche che abbia titolo alcolometrico inferiore allo 0,5 per cento in volume.";b) Deve essere un prodotto di cui al codice nc 2203 o qualsiasi prodotto contenente una miscela di birra e bevande non alcoliche di cui al codice nc 2206 e, in entrambi i casi, con un titolo alcolometrico effettivo superiore allo 0,5 per cento in volume.;c) Deve essere un prodotto qualsiasi contenente una miscela di birra e bevande non alcoliche di cui al codice nc 2206 e con un titolo alcolometrico effettivo uguale allo 0,5 per cento in volume.;d) Deve essere un prodotto di cui al codice nc 2203 o qualsiasi prodotto contenente una miscela di birra e bevande non alcoliche di cui al codice nc 2206 e, in entrambi i casi, con un titolo alcolometrico effettivo inferiore allo 0,5 per cento in volume.;2
Ai fini delle accise, si considera essere intervenuta una distruzione totale o una perdita irrimediabile qualora:;a) Il prodotto risulti essere danneggiato e quindi non si può immettere in circolazione in regime sospensivo.;b) Il prodotto non possa essere assoggettato al regime sospensivo di deposito.;c) Il prodotto non sia più utilizzabile come prodotto sottoposto ad accisa.;d) Il prodotto risulti inutilizzabile ma è comunque legittimato ad essere sottoposto ad accisa.;3
Quale articolo di quale normativa prevede il deposito fiscale?;a) L'art. 1 comma 2 lett. e) del D.M. nr. 322 del 17 maggio 1995.;b) L'art. 1 comma 2 lett. e) del D.Lgs 504 del 26 ottobre 1995.;c) L'art. 4 comma 3 del D.M. nr. 210 del 25 marzo 1996.;d) L'art. 1 comma 2 lett. f) del D.Lgs 504 del 26 ottobre 1995.;2
In relazione all'art. 18 comma 1 D.Lgs. 504/95, la Guardia di Finanza può istituire uffici finanziari di fabbrica presso i depositi fiscali?;a) Si.;b) No, è una prerogativa della Direzione Generale dell'Agenzia delle Entrate e della Riscossione.;c) No, è una prerogativa del Sindaco del Comune competente per territorio.;d) No, non è possibile.;4
A norma dell'art. 1 del T.U.A. lo speditore registrato è:;a) Persona fisica o giuridica autorizzata dall'Amministrazione Finanziaria all'esercizio della sua attività economica.;b) Il legale rappresentante dell'azienda che spedisce la merce.;c) Il soggetto giuridico autorizzato dall'Amministrazione Finanziaria a fabbricare, trasformare, detenere, ricevere o spedire prodotti sottoposti ad accisa in regime sospensivo di un deposito fiscale.;d) Nessuna delle alternative è corretta.;1
Il destinatario certificato è...;a) Persona fisica o giuridica autorizzata all'esercizio della sua attività dall'Amministrazione Finanziaria.;b) L'Amministrazione comunale.;c) Persona giuridica ammessa ad effettuare la sua attività dall'ADM.;d) Il consumatore finale.;1
Cosa è sancito all'art. 9 comma 1 del D.M. 25 marzo 1996 n. 210?;"a) Stabilisce che la circolazione dei prodotti in regime sospensivo deve avvenire con scorta del ""Documento di Accompagnamento Semplificato"".";"b) Che la circolazione dei prodotti ad accisa assolta deve avvenire con scorta del ""Documento di Accompagnamento Semplificato"".";"c) Definisce la
composizione e le modalità di emissione del DAA.";d) Stabilisce che il D.A.S. deve essere inoltrato sia all'ADM che all'Agenzia delle Entrate.;2
In quale modo vengono considerate le operazioni effettuate con provenienza Repubblica di San Marino?;a) Il D.Lgs. 504/1995 non rileva nessuna indicazione sull'argomento.;b) sono considerate come provenienti da Stato Extra-Unione Europea.;c) Sono considerate come provenienti dalla Repubblica italiana.;d) sono considerate come provenienti dalla Francia.;3
"I ""biogas"" destinati ad uso privato del produttore privato, sono soggetti ad accisa?";a) Sono sottoposti ad accisa solo se derivanti dalla decomposizione biologica di produzioni agricole dedicate.;b) No, non lo sono.;c) Sono sottoposti ad accisa solo se derivanti dalla decomposizione biologica di rifiuti da giardinaggio e gestione del verde.;d) Sì;2
A quale condizione essenziale possono viaggiare i tabacchi lavorati?;a) L'applicazione, sui singoli condizionamenti, di appositi contrassegni dell'Agenzia delle Dogane e dei Monopoli.;b) Con l'applicazione, sui singoli condizionamenti, di appositi contrassegni di Stato.;c) L'applicazione, sui singoli condizionamenti, di appositi contrassegni del Ministero della Salute.;d) L'applicazione, sui singoli condizionamenti, di appositi contrassegni della Guardia di Finanza.;2
Cosa si indica con rivendite specializzate quando si parla di tabacchi ?;a) Si intendono le rivendite ubicate presso particolari strutture purché abbiano esclusivo accesso dalla struttura ospitante e non siano dotate di ingressi autonomi e diretti sulla pubblica via (caserme, aeroporti, stazioni ferroviarie...).;"b) Si intendono le rivendite meglio denominate ""duty free"", ubicate principalmente all'interno di stazioni, aeroporti ecc.";c) Si intendono le rivendite che godono di speciali regimi autorizzativi poiché ubicati in luoghi di interesse turistico.;d) Si intendono le rivendite ubicate all'interno di Casinò e sale Bingo, a cui possono avere accesso solo i giocatori ed i frequentatori dello specifico luogo.;1
L'art. 40 del T.U.A. riguarda la sottrazione all'accertamento o al pagamento dell'accisa sui prodotti energetici. Di che tipo di reato si tratta?;a) Trattasi di reato proprio.;b) Trattasi di reato comune, dato che chiunque può porre in essere il comportamento.;c) Reato tipico.;d) Trattandosi di reato proprio, può essere punito chiunque ponga in essere una attività tesa alla sottrazione all'accertamento o al pagamento dell'imposta, in virtù del ruolo che ricopre nel momento d'imposizione.;2
E' possibile acquistare su siti internet sigarette o prodotti da inalazione senza combustione?;a) No, trattasi di generi soggetti al Monopolio della Stato, che possono essere venduti solo da soggetti autorizzati.;b) Nessuna risposta è completa.;c) Sì, è possibile acquistare tutti i prodotti citati sui siti autorizzati dall'ADM.;d) Sì, è possibile acquistare i prodotti online.;1
E' contemplato un momento in cui viene meno l'obbligo di confisca, in tema accise?;a) Nessuna delle alternative proposte è corretta.;b) Sì, quando vi è estinzione del reato.;c) Nel momento in cui il reato è commesso da un soggetto straniero residente in Italia.;d) Nel momento in cui il reato è commesso da un soggetto straniero non residente in Italia.;2
Per il T.U.A., come vengono considerate le operazioni effettuate nei confronti della Repubblica di San Marino?;a) Sono considerate come provenienti dall'Italia;b) Sono considerate proprio come provenienti da San Marino;c) Sono sempre da considerarsi operazioni esenti;d) Sono considerate come provenienti dalla Germania;1
In quale momento specifico l'imposta diventa esigibile per i prodotti sottoposti ad accisa?;a) Al momento della circolazione, anche se in regime di sospensione.;b) Sempre al momento della fabbricazione.;c) Al momento dell' immissione al consumo.;d) Al momento del loro arrivo in un qualsiasi deposito fiscale del Paese di destinazione.;3
I commi 2 e 6 dell'art. 18 del T.U.A. a quali tipologie di poteri fanno riferimento?;a) Nessuna delle alternative è corretta.;b) Poteri esclusivi attribuiti all'Amministrazione finanziaria.;c) Poteri esclusivi attribuiti alla Guardia di Finanza.;d) Poteri comuni all'Amministrazione finanziaria e alla Guardia di Finanza.;4
Cosa autorizza l'amministrazione finanziaria?;a) Il regime del deposito fiscale.;b) La produzione dei fiammiferi.;c) Nessuna risposta è corretta.;d) L'accesso negli opifici da parte del personale della Guardia di Finanza.;1
Come è definito il momento che intercorre tra la nascita dell'obbligazione e l'esigibilità dell'imposta dell'accisa?;a) Regime di riscossione dell'imposta.;b) E' definito regime di sospensione dell'imposta.;c) Vige il regime di interruzione dell'imposta.;d) Nessuna risposta è corretta.;2
Nell'ambito del Testo Unico in materia di Accise com'è denominato il soggetto che, nell'esercizio della sua attività economica, riceve prodotti sottoposti ad accisa in regime sospensivo, provenienti da un altro Stato membro o dal territorio dello Stato?;a) Destinatario autorizzato.;b) R.D.P.A. (Responsabile destinazione prodotti sottoposti ad accisa).;c) Destinatario registrato.;d) Trader.;3
In tutti i casi in cui vi siano più soggetti tenuti al pagamento dell'accisa:;a) I medesimi sono responsabili in solido dell'imposta.;b) I medesimi non sono responsabili in solido dell'imposta.;c) I medesimi sono responsabili non nella stessa quantità del pagamento dell'imposta.;d) Non è una casistica affrontata dal T.U.A.;1
Qualora venga autorizzata una miscelazione di prodotti di cui al comma 1 dell'art. 21 del T.U.A., tra di loro o con altre sostanze, come è dovuta l'imposta indiretta?;a) E' dovuta secondo le caratteristiche della miscela risultante.;b) E' dovuta secondo le caratteristiche dei singoli prodotti utilizzati.;c) E' stabilita sulla base della caratteristica del prodotto dominante.;d) Nessuna alternativa è corretta.;1
Cosa è la ricerca descritta nel T.U.A.?;a) Consiste in un atto autoritativo che ha come scopo la raccolta dei documenti e l'acquisizione del materiale che può risultare utile per l'attività ispettiva in corso.;b) E' un atto non autoritativo.;c) E' un atto non autoritativo, che può essere eseguito senza il consenso della parte, anche se la stessa sostiene di aver già consegnato tutti i documenti richiesti.;d) Consiste in un atto autoritativo che si effettua con il consenso della parte ed è finalizzato alla mera raccolta dei documenti utili per le indagini.;1
Lo speditore registrato:;a) Tutte le alternative sono corrette.;b) Deve iscrivere nella propria contabilità i prodotti sottoposti ad accisa in regime sospensivo al momento della spedizione.;c) Deve fornire al trasportatore una copia stampata del documento amministrativo elettronico o documento commerciale che indichi il codice unico di riferimento amministrativo.;d) Deve sottoporsi a qualsiasi controllo o accertamento anche intesi a verificare la regolarità delle spedizioni effettuate.;1
Quali sono le operazioni ricomprese tra le attività di accesso, controlli e verifiche in materia di accise attribuiti alla Guardia di Finanza?;a) Non prelevare campioni.;"b) Esame della
documentazione in materia di sicurezza sul lavoro.";c) Non esaminare sicuramente la documentazione amministrativa e fiscale.;d) Accesso e ricognizione dell'impianto.;4
Nel caso in cui vi sia notizia o fondato sospetto di violazioni costituenti reato previste al D.Lgs. 504/1995, chi può procedere d'iniziativa a perquisizione domiciliare?;a) Ai sensi dell'art. 33 in combinato con l'art. 31 L. 4/1929, gli Ufficiali ed il personale appartenente al ruolo ispettori del Corpo della Guardia di Finanza.;"b) Ufficiali del Corpo della Guardia di Finanza ai
sensi dell'art. 32 L. 4/1929.";c) Ufficiali di Polizia Tributaria ai sensi dell'art. 33 L. 4/1929.;d) Ai sensi dell'art. 32 L. 4/1929, i funzionari dell'Agenzia delle Dogane e dei Monopoli.;1
Quale è la definizione, tra le seguenti alternative, di prodotto assoggettato ad accisa indicata nell'art. 1 comma 2 lettera d) del D.Lgs. 504/1995?;"a) ""[...]prodotto per il quale il debito di imposta è stato assolto nella misura del 50%"".";"b) ""[...]prodotto per il quale il debito di imposta è stato assolto "".";"c) ""[...]prodotto per il quale il debito di imposta non è stato assolto "".";"d) ""[...]prodotto per il quale è stata sospesa la circolazione"".";2
"Quale è la definizione esatta di ""accisa"" contemplata nell'art. 1 comma 2 lettera a) del D.Lgs. 504/1995?";"a) ""l'imposizione indiretta sulla produzione o sul consumo dei prodotti energetici, dell'alcole etilico e delle bevande alcoliche, dei tabacchi lavorati, diversa dalle altre imposizioni indirette previste dal Titolo III del presente testo unico"".";"b) ""l'imposizione indiretta sulla produzione o sul consumo dei prodotti energetici, dell'alcole etilico e delle bevande alcoliche, dell'energia elettrica e dei tabacchi lavorati"".";"c) ""l'imposizione indiretta sulla produzione o sul consumo dei prodotti energetici, dell'alcole etilico e delle bevande alcoliche, dell'energia elettrica e dei tabacchi lavorati, diversa dalle altre imposizioni indirette previste dal Titolo III del citato testo normativo.";"d) ""l'imposizione indiretta sulla produzione dei prodotti energetici, dell'alcole etilico e delle bevande alcoliche, dell'energia elettrica e dei tabacchi lavorati, diversa dalle altre imposizioni indirette previste dal Titolo III del presente testo unico.";3
"Da quali soggetti, tra i seguenti, possono essere
effettuati accertamenti tecnici di cui al comma 5
dell'art. 18 del D.Lgs. 26 ottobre 1995, n. 504?";a) Esclusivamente dalla Guardia di Finanza;b) Congiuntamente dalla Guardia di Finanza e dall'Agenzia delle Dogane, sulla base di piani disciplinati con decreti emanati dal Direttore dell'Agenzia delle Dogane;c) Dalla Guardia di Finanza, avvalendosi della Polizia Scientifica;d) Principalmente dai competenti organi tecnici dell'Agenzia delle Dogane, per controllare, anche per fini diversi da quelli tributari, l'osservanza di disposizioni nazionali o comunitarie;4
In che misura è obbligato a prestare cauzione il depositario?;a) Del 30% dell'imposta che grava sulla quantità massima di prodotti detenuti nel deposito fiscale;b) Del 50% dell'imposta che grava sulla quantità massima di prodotti detenuti nel deposito fiscale;c) Del 20% dell'imposta che grava sulla quantità massima di prodotti detenuti nel deposito fiscale;d) Del 10% dell'imposta che grava sulla quantità massima di prodotti detenuti nel deposito fiscale;4
L'Amministrazione finanziaria, in materia di accise, ha facoltà di esonerare dall'obbligo di cauzione le ditte affidabili e di notoria solvibilità?;a) No;b) Solo su autorizzazione della dogana;c) Sì;d) Solo su autorizzazione della Camera di Commercio;3
Chi, tra i seguenti, è un soggetto obbligato al pagamento dell'accisa?;a) Il consumatore finale;b) Il trasportatore;c) Il titolare del deposito commerciale;"d) Il titolare del Deposito
Fiscale dal quale avviene
l'immissione in consumo";4
Quali tra i seguenti sono poteri e a chi sono attribuiti in materia di accise?;a) Solo i poteri esclusivi attribuiti al Corpo della Guardia di Finanza.;b) Solo i poteri esclusivi attribuiti all'Amministrazione finanziaria.;c) Poteri attribuiti al Corpo della Guardia di Finanza e all'Amministrazione finanziaria.;d) Nessuna delle alternative è corretta.;3
E' possibile svolgere un'attività di vigilanza fiscale saltuariamente presso i depositi abilitati alla fabbricazione di tabacchi lavorati?;a) No, l'art. 18 comma 1- bis dispone un'attività di vigilanza fiscale permanente da parte dell'Amministrazione Finanziaria che si avvale della collaborazione dei militari della Guardia di Finanza.;b) Si, come previsto dall'art. 18 comma 1-bis.;c) Si, l'art. 18 comma 1-bis dispone un'attività di vigilanza fiscale da espletare con modalità dinamiche da parte dei militari della Guardia di Finanza.;d) Non è prevista alcuna forma di vigilanza.;1
Su cosa incidono o vanno a colpire le imposte di fabbricazione nel nostro ordinamento?;a) Beni di lusso.;b) Nessuna delle precedenti.;c) Beni di prima necessità.;d) Beni prodotti attraverso materie prime importate da Paesi extra-Ue.;2
Per quale motivo, tra i seguenti, è necessario operare in regime di deposito fiscale?;a) il deposito fiduciario sussidiario di fabbrica;b) La fabbricazione dei prodotti non soggetti ad accisa che avviene in un opificio industriale;c) permettere al titolare la spedizione dei prodotti sottoposti ad accisa;d) La fabbricazione dei prodotti soggetti ad accisa che avviene in un opificio industriale;4
"A quali attività specifiche si riferisce ""l'esame dei documenti"" a corredo del trasferimento dei prodotti sottoposti ad accisa?";a) Nessuna delle alternative è corretta.;b) Non è afferente al controllo di eventuali reintroduzioni di beni in deposito.;c) Non riguarda la verifica delle variazioni del destinatiario o del luogo di consegna.;"d) Gli aspetti qualitativi e quantitativi del prodotto trasferito; indicazione del tempo intercorrente per il trasferimento della merce.";4
"Nel nostro ordinamento e nello specifico nel T.U.A. a quale articolo si trova la disciplina del ""deposito fiscale""?";a) L'art. 1 comma 2 lett. f) del D.Lgs 504 del 26 ottobre 1995.;b) L'art. 1 comma 2 lett. e) del D.M. nr. 322 del 17 maggio 1995.;c) L'art. 4 comma 3 del D.M. nr. 210 del 25 marzo 1996.;d) L'art. 1 comma 2 lett. e) del D.Lgs 504 del 26 ottobre 1995.;4
Attraverso quale operazione si determina la giacenza contabile?;a) Coincide con il totale carico.;b) Dalla differenza tra il totale carico e lo scarico.;c) Sommando il totale carico allo scarico.;d) Nessuna delle alternative è corretta.;2
I prodotti soggetti ad accisa destinati ad essere forniti nel quadro di relazioni diplomatiche o consolari, sono esenti dal pagamento del tributo?;a) No, l'accisa è sempre esigibile.;b) Sì, secondo quanto previsto dall'art. 11 comma 5 del T.U.A.;c) Sì, secondo quanto previsto dall'art. 17, comma 1 del T.U.A.;d) Nessuna risposta è corretta.;3
Nel caso di cessione di prodotto alcolico, in un duty free aeroportuale, ad un passeggero diretto in un Paese eExtra-UE, sorge l'esigibilità dell'imposta?;a) No, non sorge alcun obbligo del pagamento dell'imposta perché i prodotti devono essere considerati in esportazione.;"b) No, l'obbligo di
pagamento era già sorto al momento dell'esposizione del prodotto nel duty free.";"c) Sì, l'imposta è
immediatamente esigibile.";d) Nessuna risposta è corretta.;1
Nell'ambito delle sanzioni previste dal T.U.A.,come viene considerato il tentativo di sottrazione all'accertamento o al pagamento dell'accisa sui prodotti energetici?;a) Non viene punito perché il reato è solo potenzialmente configurabile ma non si è consumato.;b) Viene punito con la stessa pena prevista per il reato consumato.;c) Il tentativo rileva solo se la quantità di prodotto energetico è rilevante ai fini dell'imposta.;d) Il tentativo non è mai punito.;2
In ambito di prodotti energetici, la fabbricazione dei prodotti soggetti ad accisa in tempi diversi da quelli dichiarati nella comunicazione di lavoro, se prevista, come viene considerata?;a) Viene equiparata al tentativo anche con il supporto della prova contraria, perché le dichiarazioni sono espressione del rischio di frode.;b) Si considera come tentativo di sottrarre il prodotto all'accertamento, salvo che venga fornita prova.;c) Non viene equiparata al tentativo, essendo un mero errore di comunicazione.;d) Si considera come tentativo di sottrarre il prodotto all'accertamento, salvo che venga fornita prova contraria.;4
Per quanto concerne i presupposti soggettivi, la L. 1293/1957 stabilisce che può essere autorizzato alla gestione di una rivendita di generi di monopoli il soggetto:;a) Maggiorenne che presti la propria opera, con rapporo di lavoro continuativo, alle dipendenza altrui.;b) Maggiorenne senza la cittadinanza di uno degli Stati membri UE.;c) Maggiorenne inabilitato o interdetto.;"d) Maggiorenne che abbia presentato domanda, inserendo le sue generalità
e l'ubicazione del locale da destinare a rivendita.";4
Ai sensi del T.U.A., in relazione ai territori di efficacia delle norme, come sono considerate le operazioni effettuate in destinazione alla Repubblica di San Marino?;a) Sono considerate come destinate alla Repubblica Francese;b) Sono sempre da considerarsi operazioni esenti;c) Sono considerate proprio come destinate a San Marino;d) Sono considerate come destinate alla Repubblica Italiana;4
I distributori che effettuano il cambio dell'olio motore cosa devono istituire?;a) L'istituzione del registro di carico degli oli usati.;b) L'istituzione del registro di carico.;c) L'istituzione del registro di carico e scarico degli oli usati.;d) L'istituzione del registro di scarico degli oli usati.;3
Nei Comuni con popolazione fino a 30.000 abitanti, per istituire una rivendita ordinaria di tabacchi lavorati, quale distanza dalla più vicina rivendita deve esserci?;a) 150 metri.;b) 300 metri.;c) Non c'è una distanza minima da rispettare.;d) 50 metri.;2
Per effetto della depenalizzazione dell'art. 1 del D.Lgs. n. 8/2016, come viene sanzionata la violazione di sottrazione all'accertamento o al pagamento dell'accisa sul gas naturale per quantitativi inferiori a 5.000 metri cubi?;a) Con la multa dal triplo al decuplo dell'imposta evasa, non inferiore in ogni caso a 516 euro.;b) Con la multa dal doppio al decuplo dell'imposta evasa, non inferiore in ogni caso a 516 euro.;c) Nessuna delle altre alternative proposte è corretta.;d) Con la multa dal doppio al quadruplo dell'imposta evasa, non inferiore in ogni caso a 516 euro.;2
Con che modalità avviene l'accertamento dell'accisa sui tabacchi lavorati?;a) Per qualità.;b) Nessuna delle alternative proposte è corretta.;c) Per quantità.;d) Per quantità e qualità.;4
In ambito accise, è necessaria la presenza del legale per procedere all'esecuzione di ricerche, nel caso in cui il contribuente sostenga di aver esibito tutti i documenti richiesti?;a) Si, se l'A.G. non è stata informata.;b) No.;c) Si, solo nelle ore notturne.;d) Si.;2
"In materia di accise, cosa si intende con il ""principio dell'irretroattività della norma sanzionatoria""?";a) È un principio che possiamo annoverare tra i principi generali per l'applicazione delle sanzioni di carattere amministrativo in materia di accise.;b) È un principio che possiamo annoverare tra i principi generali per l'applicazione delle sanzioni di carattere civile in materia di accise.;c) È un principio che possiamo annoverare tra le attenuanti per l'applicazione delle sanzioni di carattere penale in materia di accise.;d) È un principio che possiamo annoverare tra i principi generali per l'applicazione delle sanzioni di carattere penale in materia di accise.;1
