Come possono essere tutelati gli interessi dell'Erario quando i soggetti autorizzati operano con prodotti in regime sospensivo?;a) Viene rimessa al soggetto la facoltà di depositare una cauzione.;b) Non esiste un obbligo specifico.;c) Attraverso la previsione dell'obbligo di cauzione.;d) Con l'obbligo di versamento tassativo del 3,5% dell'imposta.;3
"I ""depositi liberi"" sono strutture di deposito pubbliche?";a) Nessuna delle alternative proposte è corretta;b) No, sono quelle strutture in cui sono ricevuti, spediti, trasformati o lavorati prodotti ad accisa assolta;c) Vero;d) No, sono strutture in cui vengono custodite merci di vario genere;2
"In ambito accise, cosa si intende con il c.d. ""principio di legalità""?";a) È un principio che possiamo annoverare tra i principi generali per l'applicazione delle sanzioni di carattere civile in materia di accise.;b) È un principio che possiamo annoverare tra i principi generali per l'applicazione delle sanzioni di carattere penale in materia di accise.;c) Si trova tra i principi generali per l'applicazione delle sanzioni di carattere amministrativo in materia di accise.;d) È un principio che possiamo annoverare tra le attenuanti per l'applicazione delle sanzioni di carattere penale in materia di accise.;3
L'esercizio del regime del deposito fiscale...;a) Richiede in ogni caso il rilascio di una specifica licenza, ma non occorre che sia autorizzato dall'Amministrazione Finanziaria.;b) Viene autorizzato dall'Amministrazione Finanziaria e, per i prodotti diversi dai tabacchi lavorati, richiede il rilascio di una specifica licenza.;c) È autorizzato ma non richiede il rilascio di una specifica licenza.;d) È autorizzato dall'Amministrazione Finanziaria e richiede in ogni caso il rilascio di una specifica licenza.;2
"Chi sono considerati ""piccoli produttori"" di vino in ambito accise?";a) Sono piccoli produttori coloro i quali producono in media meno di 1.500 Hl di vino/anno.;b) Sono piccoli produttori coloro i quali producono in media meno di 10.000 Hl di vino/anno.;c) Sono piccoli produttori coloro i quali producono in media meno di 2.000 Hl di vino/anno.;d) Sono piccoli produttori coloro i quali producono in media meno di 1.000 Hl di vino/anno.;4
Esistono unicamente le rivendite di generi di monopolio ordinarie?;a) Si.;b) No, esistono anche quelle specializzate.;c) No, esistono anche quelle internazionali.;d) No, esistono anche quelle speciali.;4
Cosa vanno a colpire le imposte indirette sul consumo nell'ordinamento italiano?;a) Beni di larga diffusione.;b) Beni di lusso delineati annualmente da un Comitato apposito dell'Unione Europea.;c) Beni mobili di lusso.;d) Beni di carattere generico.;1
Chi ha il compito di decidere le caratteristiche ed il prezzo dei contrassegni fiscali?;a) Agenzia Dogane e Monopoli.;b) Ministero delle politiche agricole, alimentari e forestali.;c) Il Ministero delle Finanze.;d) Ministero dello Sviluppo Economico.;3
"Cosa si intende per ""duty free shop""?";a) Nessuna risposta è corretta.;b) Si tratta di negozi situati principalmente negli aeroporti i cui prodotti sono soggetti a sconti particolari.;c) Si tratta di negozi che vendono unicamente prodotti soggetti ad imposta non assolta.;d) Si tratta di un negozio letteralmente senza imposte, in cui si applica un regime fiscale agevolato in merito alla vendita di specifici prodotti.;4
A norma dell'art. 39-ter del T.U.A. i prodotti che non contengono tabacco...;a) Non sono considerati tabacchi lavorati quando assumono una funzione esclusivamente medica.;b) Sono assimilati sempre al tabacco lavorato.;c) Sono assimilati ai prodotti da inalazione.;d) Nessuna risposta è corretta.;1
Cosa è disciplinato dal comma 3 dell'art. 18 del T.U.A. ?;a) I poteri attribuiti ai soli funzionari doganali.;"b) I poteri comuni
attribuiti sia al Corpo della Guardia di Finanza che all'Amministrazione finanziaria.";c) I poteri esclusivi attribuiti all'Amministrazione finanziaria.;d) I poteri esclusivi attribuiti al Corpo della Guardia di Finanza.;4
"Di quante sezioni è composto il c.d. ""registro di carico e scarico""?";a) 2.;b) 3.;c) 1.;d) 4.;1
Secondo il T.U.A., come sono considerate le operazioni effettuate in destinazione alla Repubblica di San Marino?;a) Sono considerate come destinate alla Repubblica italiana.;b) Sono considerate proprio come destinate a San Marino;c) Sono considerate come destinate alla Repubblica francese;d) Sono sempre da considerarsi operazioni esenti;1
In quale momento si rende esigibile l'accisa?;a) Al momento dello svincolo da un regime sospensivo;b) Al momento della fabbricazione;c) Al momento del ricevimento da parte del deposito commerciale destinatario;d) Quando il prodotto viene trasferito ad un altro deposito fiscale;1
"Cosa si intende per ""prodotto assoggettato ad accisa"", secondo la definizione del T.U.A.?";a) il prodotto cui si applica il regime fiscale delle accise;b) il prodotto sottoposto ad accisa per il quale è stato assolto il debito d'imposta;c) nessuna delle altre opzioni di risposta è corretta;d) il prodotto sottoposto ad accisa per il quale non è stato assolto il debito d'imposta;2
Quale articolo del T.U.A. conferisce poteri all'Amministrazione Finanziaria ed alla Guardia di Finanza per l'accertamento delle violazioni in ambito accise?;a) art.48;b) art. 18;c) art.8;d) art. 38;2
Per la circolazione intracomunitaria di alcole etilico ad accisa sospesa la garanzia dovuta è pari al:;a) 50% dell'accisa sospesa.;b) 10% dell'accisa sospesa.;c) 20% dell'accisa sospesa.;d) La totale accisa.;2
Quali criteri sono utlizzati per accertare un prodotto sottoposto ad accisa?;a) Quantità e valore.;b) Quantità e qualità.;c) Qualità e volume.;d) Volume e valore.;2
"La lettera ""O"" relativamente al 7° carattere del cd. codice accisa, cosa indica?";a) Per l'alcole e bevande alcoliche.;b) I prodotti energetici.;c) Per i tabacchi.;d) Per impianti di produzione di soli oli e grassi vegetali e animali.;2
Per l'installazione di un distributore automatico per la vendita di generi di monopolio, cosa deve fare il titolare della rivendita?;a) Presentare apposita domanda via pec al Reparto GdF competente per territorio.;b) Presentare apposita domanda in marca da bollo all'ufficio regionale di AAMS competente per territorio. Nella domanda devono essere indicate le distanze tra il luogo di installazione e le rivendite più vicine.;c) Presentare apposita domanda in marca da bollo all'ufficio dell'ADM più vicino. Si devono specificare eventuali presenze di rivendite nel raggio di 50 metri dal punto in cui si intende installare il distributore.;d) Nessuna risposta è corretta.;2
L'energia elettrica prodotta per uso proprio da un impianto fotovoltaico, è sottoposta al regime delle accise?;a) L'energia prodotta con impianti azionati da fonti rinnovabili, con potenza non oltre i 20 kW, non è sottoposta ad accisa.;b) Sì, è sottoposta al regime delle accise .;c) Sì, l'energia elettrica prodotta con impianti azionati da fonti rinnovabili, con potenza inferiore a 20 kW, è sempre sottoposta al regime delle accise.;d) Sì, l'energia elettrica prodotta con impianti azionati da fonti rinnovabili, con potenza pari a 15kW, è sottoposta al regime delle accise.;1
Gli oli lubrificanti utilizzati nella lavorazione di gomma naturale e sintetica, sono assoggettati ad accisa?;a) No, sono esclusi.;b) Sì, sempre;c) Sì, ma con una diminuzione del 10% dell'imposta;d) Sì, ma con regime agevolato;1
A quanto ammonta l'accisa sui prodotti energetici utilizzati in impieghi nei trasporti ferroviari di passeggeri e merci?;a) L'accisa è esente.;b) 55% aliquota ordinaria.;c) 34% aliquota ordinaria.;d) 70% aliquota ordinaria.;1
Nel caso di eccedenza tra il 5‰ e 1% dell'erogato, in ambito di attività ispettiva in materia di accise svolto nei confronti di un impianto di distribuzione stradale, quali sanzioni amministrative sono previste?;"a) Irregolare tenuta del registro di carico; eccedenza non consentita (sanzione amministrativa da € 1.540 a € 9.290)";"b) E' prevista l'irregolare tenuta del registro di carico; eccedenza non consentita (sanzione amministrativa da € 154 a € 929).";"c) Irregolare tenuta del registro di carico; eccedenza non consentita (sanzione amministrativa da € 256 a € 1.024).";d) Nessuna delle alternative è corretta.;2
I militari che concorrono nel reato di fabbricazione clandestina di alcole e bevande alcoliche a quali conseguenze vanno incontro?;a) Sono puniti con sanzione amministrativa.;b) Alla reclusione da quattro a sei anni, oltre la multa.;c) Arresto.;d) nessuna delle alternative proposte è corretta.;2
Nell'ambito del T.U.A, quale è il soggetto che, nell'esercizio della sua attività economica, riceve prodotti sottoposti ad accisa in regime sospensivo, provenienti da un altro Stato membro o dal territorio dello Stato?;a) Destinatario autorizzato.;b) R.D.P.A. (Responsabile destinazione prodotti sottoposti ad accisa).;c) E' il destinatario registrato.;d) Trader.;3
"Quale tra le seguenti è la definizione esatta di ""prodotto assoggettato ad accisa""?";a) Prodotto per il quale il debito di imposta non è stato assolto .;b) Prodotto per il quale il debito di imposta è stato assolto nella misura del 50%.;c) Prodotto per il quale il debito di imposta è stato assolto.;d) Prodotto per il quale è stata sospesa la circolazione.;3
Quale tipologia di regime si applica all'opificio in cui si fabbricano prodotti sottoposti ad accisa?;a) Deposito fiscale.;b) Operatore professionale registrato.;c) Importatore abituale.;d) Deposito fiduciario sussidiario di fabbrica.;1
"Con riguardo ai ""prodotti sensibili"" in materia di accise gli stessi a cosa vengono sottoposti?";a) A controllo permanente da parte dei Laboratori dell'Agenzia delle Dogane e dei Monopoli.;b) Ad un regime fiscale agevolato.;c) Ad un regime di vigilanza fiscale.;d) Ad una esenzione fiscale generica.;3
Qual è la norma cardine in materia di poteri ispettivi nel settore delle accise?;a) Art. 20 del D.Lgs. 504/1995.;b) Art. 19 del D.Lgs. 504/1995.;c) Art. 22 del D.Lgs. 504/1995.;d) Art. 18 del D.Lgs. 504/1995.;4
Quale è la sanzione prevista per il fenomeno dell'associazione a scopo di fabbricazione clandestina di alcole e bevande alcoliche?;a) Con la reclusione da tre mesi ad un anno.;b) Nessuna delle alternative proposte è corretta.;c) Con la reclusione da 1 anno a 6 anni.;d) Con la reclusione da sei mesi a 2 anni.;1
Qualora la deficienza riscontrata sia inferiore al calo legale che tipologia di sanzione è prevista in materia di accise?;a) Penale.;b) Nessuna violazione.;c) Amministrativa.;d) Sia penale che amministrativa.;2
Quante volte il depositario autorizzato deve redigere il bilancio energetico relativo al deposito fiscale?;a) Ogni sei mesi;b) Almeno una volta l'anno;c) Ogni due mesi;d) Trimestralmente;2
L'esercizio del deposito fiscale è assoggettato al rilascio di una licenza?;a) Sì, come previsto dall'art. 63 TUA;b) Nessuna delle alternative proposte è corretta;c) No, è sufficiente la sola richiesta;d) Sì, come disciplinato dall'art. 23 TUA;1
Il metano biologico è assoggettato ad accisa?;a) No, solo se destinato agli usi propri del produttore;b) Solo nei casi espressamente previsti;c) Solo se presente metano puro superiore al 18%;d) Sì;1
Di che tipo di agevolazione beneficiano i carburanti destinati ai lavori agricoli?;a) Benzina agricola, riduzione accisa del 62% aliquota autotrazione - Gasolio agricolo riduzione accisa del 78% aliquota autotrazione.;b) Benzina agricola, riduzione accisa del 61% aliquota autotrazione - Gasolio agricolo riduzione accisa del 78% aliquota autotrazione.;c) Benzina agricola, riduzione accisa del 63% aliquota autotrazione - Gasolio agricolo riduzione accisa del 80% aliquota autotrazione.;d) Benzina agricola, riduzione accisa del 78% aliquota autotrazione - Gasolio agricolo riduzione accisa del 57% aliquota autotrazione.;2
Il metanolo viene riconosciuto come prodotto energetico?;a) No.;b) Sì, solo destinato ad essere utilizzato quale combustibile per riscaldamento o come carburante.;c) Sì.;d) Sì, solo se commercializzato con altri prodotti assoggettati ad accisa.;2
Gli appartenenti alla Guardia di Finanza, nel corso di un'attività in materia di accise hanno l'obbligo di effettuare il campionamento dei prodotti esistenti negli impianti?;a) No. Trattasi di facoltà.;b) Sì, devono essere, tra l'altro, autorizzati dal Comandante Regionale della Guardia di Finanza, competente per territorio.;c) Sì, devono essere, tra l'altro, autorizzati dal Pubblico Ministero di turno.;d) Sì.;1
L'installazione di distributori automatici di tabacchi lavorati è subordinata all'autorizzazione dell'Agenzia delle Dogane e dei Monopoli?;a) Si, ma solo per i titolari di rivendite ordinarie.;b) No.;c) Si, ma solo per i titolari di rivendite speciali.;d) Si.;2
Ai sensi del D.Lgs 504/1995, come sono considerate le operazioni effettuate in provenienza dalla Repubblica di San Marino?;a) Sono considerate proprio come provenienti da San Marino;b) Sono considerate come provenienti dalla Repubblica Italiana;c) Sono sempre da considerarsi operazioni esenti;d) Sono considerate come provenienti dalla Repubblica Francese;2
Una quantità di 2.000 sigari a quanti Kg equivale convenzionalmente?;a) 2 Kg.;b) 5 Kg.;c) 10 Kg.;d) 20 Kg.;3
Soggetti che estraggono per uso proprio gas naturale devono pagare l'accisa?;a) No.;b) Solo se ne viene estratto più di 100 litri.;c) Solo se estratto a scopi commerciali;d) Si.;4
Nell'ambito dei controlli sulla circolazione dei prodotti assoggettati ad accisa, è obbligatorio apporre i sigilli?;a) Sì, anche qualora il controllo abbia avuto esito regolare.;b) No, ma è sempre obbligatoria l'ispezione del mezzo e l'estrazione di un campione del prodotto;c) No, si tratta di una eventualità che si prospetta utile in tutti i casi in cui sia necessario appurare l'origine della merce trasportata, la reale destinazione e il rispetto degli adempimenti connessi al trasporto.;"d) Sì, sia in caso di
controllo con esito regolare che irregolare, in cui vi sia bisogno di ulteriori approfondimenti.";3
Se un turista con volo verso paese comunitario compra una bevanda alcolica in aeroporto, cosa riceverà al pagamento?;a) il relativo scontrino fiscale, con la particolarità dell'aggiunta del numero di volo dell'acquirente e il codice fiscale dello spaccio.;b) Un normale scontrino.;c) Il relativo documento fiscale, che deve contenere, oltre alla distinta dei prodotti, anche i dati riguardanti il numero del volo e la destinazione dell'acquirente.;d) Nessuna risposta è corretta.;3
Quante copie devono essere redatte del processo verbale di constatazione per controlli presso impianti di distribuzione stradale di carburanti?;a) 6;b) 5;c) 4;d) 3;2
"Relativamente al 7° carattere del codice accisa, cosa contraddistingue la lettera ""V"" ?";a) I tabacchi.;b) L'alcole e bevande alcoliche.;c) Gli impianti di produzione di soli oli e grassi vegetali e animali.;d) Il vino.;4
In cosa consistono i contrassegni di Stato, previsti dal D.M. 322 del 10 ottobre 2003?;a) Fascette di carta filigranata di differenti colori a seconda delle tipologie di vino, che ne certificano l'origine, sulle cui bottiglie devono essere applicate.;b) Fascette di carta filigranata di differenti colori a seconda delle tipologie di vino, sulle cui bottiglie devono essere applicate.;c) Fascette di carta filigranata di diverse dimensioni e colori a seconda delle confezioni e delle tipologie di bevande alcoliche in esse contenute, su cui devono essere applicate.;d) Fascette di carta filigranata di differenti colori a seconda che il vino sia DOC o DOCG, come previsto dal Ministero delle politiche agricole, alimentari e forestali.;3
Quale circostanza legittima la circolazione dei tabacchi lavorati?;a) L'applicazione, sui singoli condizionamenti, di appositi contrassegni della Guardia di Finanza.;b) L'applicazione, sui singoli condizionamenti, di appositi contrassegni dell'Agenzia delle Dogane e dei Monopoli.;c) L'applicazione, sui singoli condizionamenti, di appositi contrassegni del Ministero della Salute.;d) L'applicazione, sui singoli condizionamenti, di appositi contrassegni di Stato.;4
Il regime del deposito fiscale è autorizzato per i tabacchi lavorati?;a) No.;b) Si, previa autorizzazione speciale dell'Amministrazione finanziaria;c) Si, solo per i tabacchi lavorati esteri.;d) Si, sempre.;1
Gli esercenti le officine di produzione di energia elettrica utilizzata per uso proprio, devono pagare l'accisa?;a) Si.;b) Solo se il consumo proprio è superiore a 200kW.;c) Solo se il consumo proprio è superiore a 300kW.;d) No.;1
Il D.lgs 26/10/1995, n. 504 prevede il rimborso dell'accisa solo oltre una determinato soglia. Quale?;a) A mente di quanto indicato nell'art. 18 comma 8, non si fa rimborso di somme inferiori o pari ad euro 15,33.;b) A mente di quanto indicato nell'art. 18 comma 8, non si fa rimborso di somme inferiori o pari ad euro 30.;c) A mente di quanto indicato nell'art. 18 comma 8, non si fa rimborso di somme inferiori o pari ad euro 72.;d) A mente di quanto indicato nell'art. 18 comma 8, non si fa rimborso di somme inferiori o pari ad euro 10,33.;2
Quale sanzione è prevista per l'esercizio di un deposito di prodotti energetici non denunciati a norma dell'art. 25 T.U.A.?;"a) La sanzione
amministrativa da € 1.032 a € 5.164.";b) Reclusione da anni 5 a anni 12.;c) Reclusione da anni 1 a anni 5.;d) Reclusione da anni 1 a anni 3.;1
Nei recinti dei depositi fiscali di bevande alcoliche possono essere detenuti prodotti alcolici ad accisa assolta?;a) Sì.;b) Sì, ma fino a 10.000 litri complessivi.;c) No, eccetto quelli strettamente necessari per il consumo aziendale.;d) No.;3
A norma dell'art. 39-septies T.U.A. a quanto ammonta l'aggio ai rivenditori per la vendita di tabacchi lavorati?;a) 15% del prezzo di vendita.;b) 20% del prezzo di vendita.;c) 10% del prezzo di vendita.;d) 5% del prezzo di vendita.;3
Nel settore dei distributori di carburanti per autotrazione, è ammesso il calo per gli oli lubrificanti contenuti in confezioni originali sigillate?;a) Sì, nella misura massima del 2%.;b) Sì, nella misura massima del 10%.;c) Sì, nella misura massima del 4%.;d) No, non è ammesso alcun calo.;4
"Con riguardo al 7° carattere del cd. codice accisa, cosa contraddistingue la lettera ""V""?";a) Contraddistingue il vino.;b) Viene adottato per l'alcole e bevande alcoliche.;c) Viene adottato per impianti di produzione di soli oli e grassi vegetali e animali.;d) Viene adottato per i tabacchi.;1
Dal 1° gennaio 2011 è stato introdotto il e-AD, emesso dal sistema telematico doganale. Quale documento ha sostituito?;"a) Bolla di
accompagnamento.";b) D.A.S.;c) D.A.A.;d) C.M.R.;3
A quali soggetti viene assegnato il codice ditta in ambito accise?;a) Alle persone giuridiche che operano in regime sospensivo.;b) Agli operatori che trattano prodotti per i quali è già stato assolto il debito di accisa.;c) Agli operatori che operano in regime sospensivo.;"d) A tutti i soggetti,
persone fisiche o giuridiche che acquistano prodotti in regime sospensivo.";2
Le forze armate nazionali sono esenti dal pagamento dell'imposta sui prodotti soggetti ad accisa?;a) Sì, solo se lo Stato è parte contraente del patto del nord Atlantico;b) Sì, nella misura del 50%;c) No;d) Sì;1
In caso d'irregolarità o d'infrazione avvenuta nel corso della circolazione di prodotti in regime sospensivo:;a) L'accisa è riscossa in Italia se l'irregolarità o l'infrazione ha ad oggetto prodotti di fabbricazione nazionale;b) Se l'irregolarità o l'infrazione è accertata nel territorio dello Stato a prescindere dal fatto che sia possibile o meno stabilire il luogo in cui è stata effettivamente commessa, essa si presume commessa nel territorio dello Stato;c) L'accisa è riscossa in Italia se l'irregolarità o l'infrazione è afferente a prodotti destinati al territorio italiano;d) Se l'irregolarità o l'infrazione è accertata nel territorio dello Stato e non è possibile stabilire il luogo in cui è stata effettivamente commessa, essa si presume commessa nel territorio dello Stato;4
L'imposta sulle accise consiste in una tassazione alla fonte?;a) Si;b) Solo nei casi previsti dalla legge;c) Solo per la merce proveniente dall' Unione Europea;d) No;4
Quali sono le sezioni del registro di carico?;a) Sezione del carico, dello scarico e giacenze contabile.;b) Sezione del carico e sezione dello scarico.;c) Solo la sezione del carico.;d) Solo la sezione dello scarico.;2
Con riferimento al contenuto dell'art. 24 ter del TUA ...;a) L'alcol etilico è sottoposto ad accisa.;b) Il tabacco da fumo si distingue dal tabacco trinciato.;c) Il gasolio commerciale usato come carburante non è assoggettato ad accisa.;d) Il gasolio commerciale usato come carburante è assoggettato ad accisa.;4
"Quale natura, nel settore delle accise, riveste il ""principio di intrasmissibilità agli eredi""?";a) È riconducibile ai principi generali per l'applicazione delle sanzioni di carattere penal- tributario in materia di accise.;b) Nessuna delle altre alternative proposte è corretta.;c) È riconducibile alle attenuanti per l'applicazione delle sanzioni di carattere penale in materia di accise.;d) È riconducibile ai principi generali per l'applicazione delle sanzioni di carattere civile in materia di accise.;2
Per quanti anni deve essere conservato il registro di carico e scarico carburanti?;a) Il registro, alla fine di ogni esercizio annuale, una volta chiuso, dovrà essere custodito per almeno 10 anni.;b) Nessuna delle altre alternative proposte è corretta.;c) Il registro, alla fine di ogni esercizio annuale, una volta chiuso, dovrà essere custodito per almeno 15 anni.;d) Il registro, alla fine di ogni esercizio annuale, una volta chiuso, dovrà essere custodito per almeno 20 anni.;2
Cosa si intende per classificazione dei prodotti sottoposti ad accisa?;a) La catalogazione dei prodotti assoggettati al regime delle accise, stabilita dalla Tariffa Doganale dell'Agenzia delle Entrate con riferimento ai capitoli ed ai codici della Nomenclatura Combinata delle merci.;b) La catalogazione dei prodotti liberi dal regime delle accise, stabilita dalla Tariffa Doganale dell'Agenzia delle Entrate con riferimento ai capitoli ed ai codici della Nomenclatura Combinata delle merci.;c) La catalogazione dei prodotti sottoposti al regime delle accise, stabilita dalla Tariffa Doganale dell'U.E. con riferimento ai capitoli ed ai codici della Nomenclatura Combinata delle merci.;d) La catalogazione dei prodotti sottoposti al regime delle accise, stabilita dallo Stato Italiano con riferimento ai capitoli ed ai codici della Nomenclatura Combinata delle merci.;3
Può essere considerato gasolio commerciale il gasolio utilizzato per attività di trasporto di persone svolta da enti pubblici?;a) Si, solo se il trasporto pubblico è eseguito con mezzi di massa massima inferiore a 5 tonnellate.;b) No.;c) Si, solo se il trasporto pubblico è eseguito con mezzi di massa massima superiore a 5 tonnellate.;d) Si.;4
"E' possibile acquistare in Italia il prodotto c.d. ""snus"" (tabacco umido in polvere per uso orale)?";a) Si, è prevista.;b) Si, ma nel limite di vendita di 20 g a persona a settimana.;c) No, in Italia è vietata l'immissione sul mercato di tabacco per uso orale, ai sensi dell'art. 18 D.Lgs. 6/2016.;d) Il divieto di immissione sul mercato di tabacco sarà previsto a far data 1 gennaio 2028.;3
A che accisa è sottoposto il carburante impiegato per il funzionamento delle autoambulanze per il trasporto di feriti ed ammalati?;a) Totalmente esente da accisa.;b) E' sottoposto ad accisa ad aliquota ordinaria.;c) Sconta un'accisa pari al 40% dell'aliquota normale per il G.P.L. e il gas naturale a € 0,359 al litro per la benzina e a € 0,330 al litro per il gasolio.;d) In alcuni casi specifici può diventare esente.;3
Per alcol etilico si intende un prodotto con un grado alcolico pari a:;a) Qualsiasi;b) Superiore a 11 ma inferiore a 22;c) Non inferiore a 1,2;d) Superiore a 22;3
Chi effettua le verificazioni in materia di accise?;a) Competente per tale attività di controllo è l'Agenzia delle Dogane in collaborazione con la G.di F.;b) Competente per tale attività di controllo è l'Agenzia delle Entrate in collaborazione con la G.di F.;c) Competente per tale attività di controllo è la G.di F.;d) Competente per tale attività di controllo è l'Agenzia delle Entrate.;3
"In materia di accise, come si annovera il ""principio di intrasmissibilità agli eredi""?";a) È un principio che possiamo annoverare tra i principi generali per l'applicazione delle sanzioni di carattere penal- tributario in materia di accise.;b) È un principio che possiamo annoverare tra i principi generali per l'applicazione delle sanzioni di carattere amministrativo in materia di accise.;c) È un principio che possiamo annoverare tra le attenuanti per l'applicazione delle sanzioni di carattere penale in materia di accise.;d) È un principio che possiamo annoverare tra i principi generali per l'applicazione delle sanzioni di carattere civile in materia di accise.;2
Gli oli e i grassi animali e vegetali sono considerati prodotti energetici?;a) No e non sono sottoposti a tassazione anche se destinati ad essere utilizzati come combustibile per riscaldamento.;b) No e non sono sottoposti a tassazione anche se destinati ad essere utilizzati come carburante per motori.;c) Si e sono sottoposti a tassazione se destinati ad essere utilizzati come combustibile per riscaldamento o come carburante per motori.;d) No, mai.;3
Per le violazioni di cui all'art. 46 T.U.A., alterazione di congegni, impronte e contrassegni, quale sanzione è prevista?;a) Alcune condotte sono punite con la reclusione da 1 a 5 anni, altre con pene inferiori.;b) Reclusione da anni 3 a anni 5.;c) Reclusione da 1 a 3 anni.;d) Reclusione da 5 a 12 anni.;1
